#id	annotatorid	label	a1	a2
2939_2971	goldLabel	a1	meat is very healthy, for everyone, proven in many studies around the world over the last hundreds of years. vegetarianism takes away this opportunity from humans of getting healthier and stronger.	animals are a lot like ants, they are alive but do not live meaningful lives like humens, just like were allowed to kill ants we should be allowed to eat meat and not be vegetarian
2995_2987	goldLabel	a1	we should not adopt vegetarianism because many people would not have access to healthy substitutes for meat, so their nutrition would decline.	we should not adopt vegetarianism because most people do not want to, and the legitimacy of a policy rests with the public will.
2888_2987	goldLabel	a1	we should not adopt vegetarianism because it is possible to raise meat in a sustainable fashion, so total vegetarianism is unnecessary.	we should not adopt vegetarianism because most people do not want to, and the legitimacy of a policy rests with the public will.
2869_2885	goldLabel	a2	animals deserve less rights than humans, and it is legitimate for humans to prioritize their enjoyment over the suffering of animals.	meat-based dishes are an intrinsic part of ethnic, national and human culture, and moving on from that is a loss of intangible cultural value.
2966_2918	goldLabel	a1	we should not adopt vegetarianism because eating meat, even in more limited amounts than we do currently, makes people happy.	animals does not feel pain the way we do. animal suffering is not the same as human suffering and therefore it is not as immoral.
2935_2981	goldLabel	a1	many vegetarian diets are unhealthy and rely on highly processed food products whose manufacture contributes to climate change.	agricultural crop fields also kill animals, so vegetarianism doesn't actually save animal life.
2913_2918	goldLabel	a1	adopting vegetarianism will lead to millions of workers losing their jobs in the livestock industry around the globe.	animals does not feel pain the way we do. animal suffering is not the same as human suffering and therefore it is not as immoral.
2929_2994	goldLabel	a2	humans have a biological imperative to consume meat which should not be ignored through vegetarianism.	vegetarianism is not healthy for pregnant woman because they don't get enough nutrients.
2971_2992	goldLabel	a2	animals are a lot like ants, they are alive but do not live meaningful lives like humens, just like were allowed to kill ants we should be allowed to eat meat and not be vegetarian	we value human life way more than we value the life of an aninal, therefore since eating meat is the healthier choice, we should prioritize it over the lives of the animals and object vegetarianism
2920_2941	goldLabel	a1	the government should not take actions which put huge numbers of people out of work, which would be an inevitable outcome of enforced vegetarianism.	even if it is possiable to live a healthy life style without meat it is very difficult which means most people will live an unhealthy life style without meat.
2962_2899	goldLabel	a2	vegetarianism is morally wrong because the many animals now in captive will be released and won't be able to live in nature, so they will die	vegetarianism will harm our body, there are important things that are mostly found in meat that are hard to find alrenatives for (and those are pricier, which will harm the poor)
2871_2945	goldLabel	a1	a widespread shift to vegetarianism would have a massively negative impact on meat production, which is a large sector of the global economy.	in order to alleviate the harms of meat production, vegetarianism is not required by most people, only the general reduction of meat consumption.
2996_2898	goldLabel	a2	you do not have to adopt vegetarianism to protect the environment. you can eat chicken that pollutes less or just eat a little meat.	individuals should have the ability to decide what they consume which is impossible through enforced vegetarianism, as it is fundamental to the way they live their lives.
2989_2915	goldLabel	a1	vegetarians don't actually live longer, this statistic is due to the fact that a lot of people who go vegetarian are also healthy in other ways but cannot be attributed only to the diet.	we only have one life to live and one of the most universal pleasurable experiences is eating good food, so although there is some delicious vegetarian food, eating meat is part of a good life.
2877_2997	goldLabel	a1	meat is part of many people's cultural and social traditions, making vegetarianism actively uncomfortable and foreign.	we should not adopt vegetarianism because it would create a huge backlash against sustainable living.
2971_2968	goldLabel	a2	animals are a lot like ants, they are alive but do not live meaningful lives like humens, just like were allowed to kill ants we should be allowed to eat meat and not be vegetarian	some animals are alive just because of the meat industry who gives them food and protects them, if we forego meat at once the meat industry will close and those animals will die sooner.
2967_2869	goldLabel	a1	it's harder to get all the things you need for a balanced diet while being vegetarian.	animals deserve less rights than humans, and it is legitimate for humans to prioritize their enjoyment over the suffering of animals.
2995_2933	goldLabel	a1	we should not adopt vegetarianism because many people would not have access to healthy substitutes for meat, so their nutrition would decline.	humans were born omnivores, so people should have the choice to do whatever they want and be able to eat meat.
2875_2953	goldLabel	a1	many people believe meat tastes better than vegetables and they should be able to decide what they would want to eat and should not be forced to be vegetarian.	some leaders of the vegetarian &amp; vegan movements have committed literal acts of terrorism to push their agenda; a worldwide acceptance could be seen as bowing down to the method.
2892_2895	goldLabel	a2	it is not immoral to eat animals because they are not members of our social constructs and do not have moral worth, therefore a meatless diet is not morally required.	animals provide protein which humans would have difficulty securing otherwise. while other sources of protein exist, they tend to be more expensive and thus difficult to access for the poor.
2983_2864	goldLabel	a1	we should not adopt vegetarianism because it will use up the political capital that could otherwise have gone to promoting renewable energy, which is more important to the environment.	eating meat is very enjoying to alot of people and a big part of their culture and life style. if we move to vegetarianism we will reduce human happiness.
2952_2865	goldLabel	a1	vegetarianism is prone to protein, vitamin b12, zinc, and other important chemical deficiencies, making meat inclusive diets healthier.	high quantities of soy, grain, starch, or any food common for vegetarians can have adverse health effects.
2877_2945	goldLabel	a1	meat is part of many people's cultural and social traditions, making vegetarianism actively uncomfortable and foreign.	in order to alleviate the harms of meat production, vegetarianism is not required by most people, only the general reduction of meat consumption.
2894_2979	goldLabel	a2	harvesting plants for vegetarianism takes a considerable amount of land and would likely lead to deforestation if animals could not be raised	vegetarian diets don't have enough iron, calcium, and other minerals, making people more prone to disease and injury.
2980_2910	goldLabel	a2	vegetarianism hurts the life quality, health wise (later discussed) and happiness wise. meat is yummy, people should have the possibility to eat meat if they please. they will enjoy it.	individuals should have the ability to do or consume anything which doesn't cause direct, considerable third party harms, which includes meat consumption and refusing vegetarianism.
2973_2881	goldLabel	a2	animals are easier to ship around the world, as they do not need to be slaughtered until they are received, leading to less spoilage, making vegetarianism worse for food preservation.	the meat and fish production industry provides a living to hundreds of thousands of people worldwide. vegetarianism will take away they means of livelihood.
2969_2940	goldLabel	a1	meat is a major source of protein and other dietary needs, and vegetarianism would decrease the amount of these that the average person would consume.	the meat industry sustains a huge population of animals that are unfit to survive in the wild. if a large portion of the population becomes vegeterian, these animals will be killed.
2944_2879	goldLabel	a1	there are nutrients and vitamins that come predominantly from meat products, and people who abstain from them are likely to be less healthy.	animals have not demonstrated cognition or societies and are therefore not deserving of moral standing through vegetarianism.
2896_2935	goldLabel	a2	people who support vegetarianism tend to preach in an annoying fashion; by ending that we could increase public happiness.	many vegetarian diets are unhealthy and rely on highly processed food products whose manufacture contributes to climate change.
2879_2982	goldLabel	a2	animals have not demonstrated cognition or societies and are therefore not deserving of moral standing through vegetarianism.	meat eating is am important part in many traditions holidays and religions,there for we can't adopt vegetarianism
2933_2914	goldLabel	a1	humans were born omnivores, so people should have the choice to do whatever they want and be able to eat meat.	meat is delicious, the new york strips is one of the greatest meals of all time.
2951_2895	goldLabel	a2	since unlike humans, farm animals are exteremely unlikely to do something significant in their lifetime, there is no moral or real world implication to an animal having a shorter life.	animals provide protein which humans would have difficulty securing otherwise. while other sources of protein exist, they tend to be more expensive and thus difficult to access for the poor.
2932_2947	goldLabel	a1	we should not adopt vegetarianism because it would devastate communities that rely on livestock to bring in capital - like the entire country of argentina, which depends heavily on beef.	human being have evolved to be omnivores who eat both plants and meat, so it is both healthy and appropriate that we continue to behave in a way that is consistent with our evolution.
2998_2909	goldLabel	a1	this would collapse latin american democracies (brazil, uruguay etc.), whose political configurations have already been weakened by anemic international economic growth for luxury food items (steak particularly)	in the world and society we have the food chain that relay on the idea that the stronger eat the weak, vegetarian lifestyle doesn’t make it happen
2863_2983	goldLabel	a1	any sort of legal requirement for vegetarianism would be unjust, as the right to consume what one desires should be a fundamental right so long as it doesn't violate another person's bodily autonomy.	we should not adopt vegetarianism because it will use up the political capital that could otherwise have gone to promoting renewable energy, which is more important to the environment.
2863_2999	goldLabel	a1	any sort of legal requirement for vegetarianism would be unjust, as the right to consume what one desires should be a fundamental right so long as it doesn't violate another person's bodily autonomy.	most banned substances have seen a greater use in society (as with alcohol in the us in the 1920s); by making a national policy adopting vegetarianism we risk increasing consumption and undermining our effort.
2937_2964	goldLabel	a1	the meat industry is employing millions of people who will lose their jobs if we forego meat at once. we should prioritize the meat industry human workers over animals.	without farms breeding and high yield species of cow, chicken, and pigs, these species would go extinct due to vegetarianism as they do not have adaptations to protect them in nature.
2980_2923	goldLabel	a2	vegetarianism hurts the life quality, health wise (later discussed) and happiness wise. meat is yummy, people should have the possibility to eat meat if they please. they will enjoy it.	food is an important part of cultural identity and adopting vegetarianism would be inconsistent with maintaining highly valued aspects of many cultures, identification with which forms a key element in many people's identity.
2954_2951	goldLabel	a1	we should not adopt vegetarianism because most people would be forced to rely on soy for protein without meat, which has hormones in it that are detrimental if consumed in excess.	since unlike humans, farm animals are exteremely unlikely to do something significant in their lifetime, there is no moral or real world implication to an animal having a shorter life.
2960_2886	goldLabel	a1	many religions require the consumption of meat on certain holy days, making enforced vegetarianism a violation of religious freedom.	in food deserts, meat is more accessible than a diversity of vegetarian cuisine and ingredients.
2929_2901	goldLabel	a2	humans have a biological imperative to consume meat which should not be ignored through vegetarianism.	people will be anemic and lack protein if there aren't readily accessible sources
2918_2963	goldLabel	a2	animals does not feel pain the way we do. animal suffering is not the same as human suffering and therefore it is not as immoral.	we should not adopt vegetarianism because millions of peoples would lose their jobs if the meat industry went away
2921_2992	goldLabel	a1	a black market created by enforced vegetarianism would make it easier for more dangerous black markets, such as the drug and weapons markets, to find social acceptance and hide among less heinous markets.	we value human life way more than we value the life of an aninal, therefore since eating meat is the healthier choice, we should prioritize it over the lives of the animals and object vegetarianism
2964_2915	goldLabel	a1	without farms breeding and high yield species of cow, chicken, and pigs, these species would go extinct due to vegetarianism as they do not have adaptations to protect them in nature.	we only have one life to live and one of the most universal pleasurable experiences is eating good food, so although there is some delicious vegetarian food, eating meat is part of a good life.
2898_2936	goldLabel	a1	individuals should have the ability to decide what they consume which is impossible through enforced vegetarianism, as it is fundamental to the way they live their lives.	there is no moral problem in eating meat. animals have no consciousness like human beings, and slaughterhouses provide them with a quick and painless death. therefore, we do not have to adopt vegetarianism.
2961_3000	goldLabel	a1	meat and meat-derived protein is higher quality than vegetarian protein substitutes.	moral and rights are only true for humans, there for is not better to adopt vegetarianism
2880_2908	goldLabel	a1	animals can be raised in more climates than individual types of vegetables, making food more accessible for dry, arid countries that do not adopt vegetarianism.	vegetarianism is morally wrong, because people have limited amount of time to spend, by focusing on animals they spend less time fighting for people who are harmed (child labor, etc)
2915_2922	goldLabel	a2	we only have one life to live and one of the most universal pleasurable experiences is eating good food, so although there is some delicious vegetarian food, eating meat is part of a good life.	even though vegetarians avoid the hormones and antibiotics in meat, they still get very high doses of all the pesticides and herbicides that get doused over farmed plants.
2986_2869	goldLabel	a1	problems with meat production should not be addressed by abandoning it completely; rather those concerned about animal welfare should work with farmers to make it more humane.	animals deserve less rights than humans, and it is legitimate for humans to prioritize their enjoyment over the suffering of animals.
2951_2883	goldLabel	a2	since unlike humans, farm animals are exteremely unlikely to do something significant in their lifetime, there is no moral or real world implication to an animal having a shorter life.	attempting to make vegetarianism law would create a criminal society where huge swaths of the population would refuse to follow the law, weakening faith in law and the power of government.
2867_2990	goldLabel	a1	we should not adopt vegetarianism because given the propensity for waste in our society, it would not lead to significant environmental improvements.	people shouldn't be vegetarian because us, and our ancestors, have been doing so for millions of years, that's the right way for us to live.
2890_2953	goldLabel	a1	by adopting vegetarianism as a society, we are necessarily silencing voices that would prefer eating meat. of course, we are allowing other voices to be heard, but hurt the fundamental right of choice for others.	some leaders of the vegetarian &amp; vegan movements have committed literal acts of terrorism to push their agenda; a worldwide acceptance could be seen as bowing down to the method.
2916_2870	goldLabel	a1	becoming vegetarian is unhealthy. not eating meat increases the chances of anemia and malnutrition because of the lack of proteins and iron.	animal waste is an important tool for creating natural fertilizer and keeping land arable, which would be difficult to maintain under enforced vegetarianism.
2895_2999	goldLabel	a1	animals provide protein which humans would have difficulty securing otherwise. while other sources of protein exist, they tend to be more expensive and thus difficult to access for the poor.	most banned substances have seen a greater use in society (as with alcohol in the us in the 1920s); by making a national policy adopting vegetarianism we risk increasing consumption and undermining our effort.
2997_2911	goldLabel	a1	we should not adopt vegetarianism because it would create a huge backlash against sustainable living.	feeding humans is likely the most significant thing the animal can do anyway
2972_2976	goldLabel	a1	we should not adopt vegetarianism because this is a violation of personal autonomy	being vegetarians makes it harder for people you eat with, since they have to accommodate your harsh preference.
2892_2969	goldLabel	a2	it is not immoral to eat animals because they are not members of our social constructs and do not have moral worth, therefore a meatless diet is not morally required.	meat is a major source of protein and other dietary needs, and vegetarianism would decrease the amount of these that the average person would consume.
2940_2893	goldLabel	a2	the meat industry sustains a huge population of animals that are unfit to survive in the wild. if a large portion of the population becomes vegeterian, these animals will be killed.	vegetarianism is not healthy for human beings, as it lacks critical vitamins such as b12. people cannot be trusted to take such supplements instead of meat.
3001_3002	goldLabel	a2	eating meat is tasty, and eating tasty food is one of the greatest joys in life, therefore we shouldn't be vegetarians.	meat is an important part of certain cultures traditions. removing it from their diets would harm their heritage
2903_2999	goldLabel	a1	adopting vegetarianism will have a massive economic cost since you will lose all jobs and economic activity from the meat industry and it will not be replaced by crops.	most banned substances have seen a greater use in society (as with alcohol in the us in the 1920s); by making a national policy adopting vegetarianism we risk increasing consumption and undermining our effort.
2976_2905	goldLabel	a2	being vegetarians makes it harder for people you eat with, since they have to accommodate your harsh preference.	vegetarians are unable to get enough protein to live a healthy life and develop healthy muscle mass.
2923_2962	goldLabel	a1	food is an important part of cultural identity and adopting vegetarianism would be inconsistent with maintaining highly valued aspects of many cultures, identification with which forms a key element in many people's identity.	vegetarianism is morally wrong because the many animals now in captive will be released and won't be able to live in nature, so they will die
2978_2881	goldLabel	a2	there are a lot of current legislative regulations that mandate ethical slaughter of animals, we just need to expand and enforce them instead of going vegetarian.	the meat and fish production industry provides a living to hundreds of thousands of people worldwide. vegetarianism will take away they means of livelihood.
2922_2878	goldLabel	a2	even though vegetarians avoid the hormones and antibiotics in meat, they still get very high doses of all the pesticides and herbicides that get doused over farmed plants.	meat provides healthy saturated fats that vegetarians don't get enough of and are important to immune and central nervous system functioning.
2907_2989	goldLabel	a1	you do not have to adopt vegetarianism to keep you healthy. you can maintain a balanced diet and maybe even cut a little on the red-meat, but you do have not stop eating meat completely.	vegetarians don't actually live longer, this statistic is due to the fact that a lot of people who go vegetarian are also healthy in other ways but cannot be attributed only to the diet.
2901_2982	goldLabel	a1	people will be anemic and lack protein if there aren't readily accessible sources	meat eating is am important part in many traditions holidays and religions,there for we can't adopt vegetarianism
2947_2908	goldLabel	a1	human being have evolved to be omnivores who eat both plants and meat, so it is both healthy and appropriate that we continue to behave in a way that is consistent with our evolution.	vegetarianism is morally wrong, because people have limited amount of time to spend, by focusing on animals they spend less time fighting for people who are harmed (child labor, etc)
2917_2893	goldLabel	a2	although vegetables are cheaper, a lot of people don't know how to prepare filling and nutritious meals without meat, making vegetarianism unfeasible for many people.	vegetarianism is not healthy for human beings, as it lacks critical vitamins such as b12. people cannot be trusted to take such supplements instead of meat.
2953_2973	goldLabel	a2	some leaders of the vegetarian &amp; vegan movements have committed literal acts of terrorism to push their agenda; a worldwide acceptance could be seen as bowing down to the method.	animals are easier to ship around the world, as they do not need to be slaughtered until they are received, leading to less spoilage, making vegetarianism worse for food preservation.
2927_2948	goldLabel	a2	some leaders of the vegetarian & vegan movements have committed literal acts of terrorism to push their agenda; a worldwide acceptance could be seen as bowing down to the method.	conditions in the meat industry have improved drastically, life in the wild or no life at all is in no way better for these animals therefore we dont harm animals and shouldnt be vegetarians
2966_2877	goldLabel	a2	we should not adopt vegetarianism because eating meat, even in more limited amounts than we do currently, makes people happy.	meat is part of many people's cultural and social traditions, making vegetarianism actively uncomfortable and foreign.
2953_2907	goldLabel	a2	some leaders of the vegetarian &amp; vegan movements have committed literal acts of terrorism to push their agenda; a worldwide acceptance could be seen as bowing down to the method.	you do not have to adopt vegetarianism to keep you healthy. you can maintain a balanced diet and maybe even cut a little on the red-meat, but you do have not stop eating meat completely.
2989_2936	goldLabel	a1	vegetarians don't actually live longer, this statistic is due to the fact that a lot of people who go vegetarian are also healthy in other ways but cannot be attributed only to the diet.	there is no moral problem in eating meat. animals have no consciousness like human beings, and slaughterhouses provide them with a quick and painless death. therefore, we do not have to adopt vegetarianism.
2996_2950	goldLabel	a1	you do not have to adopt vegetarianism to protect the environment. you can eat chicken that pollutes less or just eat a little meat.	rights stem from one's relationship with the state, meaning a vegetarian conception of rights for animals is fundamentally illogical.
2889_2918	goldLabel	a1	in agriculture more animals are killed (pest extermination, tilling land kills underground dwellers, etc) than in the meat industry. therefore by eating more meat and less plants you actually save lives	animals does not feel pain the way we do. animal suffering is not the same as human suffering and therefore it is not as immoral.
2919_2974	goldLabel	a2	a lot of rights that apply to humans are not applied to animals (example, the right to vote); therefore the rights of humans to choose is more important than the rights of animals to live.	the meat industry hires millions of workers around the world and is the main source of income for many towns and cities, vegetarianism would jeopardize the livelihood of millions.
2953_2936	goldLabel	a2	some leaders of the vegetarian &amp; vegan movements have committed literal acts of terrorism to push their agenda; a worldwide acceptance could be seen as bowing down to the method.	there is no moral problem in eating meat. animals have no consciousness like human beings, and slaughterhouses provide them with a quick and painless death. therefore, we do not have to adopt vegetarianism.
