id	annotatorid	label	a1	a2
5745_5776	goldLabel	a2	Social media is a powerful Broadcasting tool to inform the masses, even if they aren't actively interested in the broadcast subject.	Social media allows for people with similar interests and values to form communities across the global, allowing for more cultural understanding and diffusion.
6098_6633	goldLabel	a1	Many revolutions globally have utilized social media as a platform for organization and communication. This allowed for the greater success and solidarity of these movements.	Social media gives a platform for minorities to voice their concerns thus bringing these issues to the public's attention.
6270_6656	goldLabel	a1	Social media goal is to make the information more open to public, they have more acces to to it when they use it.	Social media allows politicians to connect with the public, providing the public with better and more reliable information about them.
7166_6992	goldLabel	a1	Social media allows to connects people to active discussion and engage them in issues such as elections, crisises and more in a way that is simple and entertaining.	Social media provides a unique way for in-the-closet LGTBs living in conservative areas to be part of virtual communities and communicate with other people like them.
6067_6440	goldLabel	a2	Social media allows grass roots movement to more easily mobilize and spread awareness across large groups of people.	Social media facilitates crowd funding, which reduces health care and emergency costs for needy families.
6843_5821	goldLabel	a1	Social media allows for a platform where everyone can freely express their thoughts and opinions, allowing for the maximized attainment of free speech.	Social media brings more good than harm because it brings people joy, or they would not keep using it in such large numbers.
6327_6738	goldLabel	a2	Social media helps small businesses and entrepreneurs reach their target audience and, through expansion, creating more jobs	Social media lets people keep in touch with far away loved ones.
6533_6440	goldLabel	a2	this is a better way to send a message between all of your co-workers, students, your employees,	Social media facilitates crowd funding, which reduces health care and emergency costs for needy families.
5952_6726	goldLabel	a1	I will always find supportive communities on social media and affectionate people to any situation I'm in, so I'm less likely to be depressed and feel misunderstood	Social media shows you thing to aspire to that you won’t think of otherwise. Going to trips, trying for new jobs, changing your attitude and more.
6356_5945	goldLabel	a1	social media can create a better world by connecting people that would have never met otherwise. it can help bring together different cultures such as create a conversation between an Israeli and an Iranian	Social Media gives people a place to form support groups, those who want to help can easly find people who need help by forming groups and offering advices.
7091_6067	goldLabel	a2	Social media allows celebrities, politicians, and other public characters to create accessible platforms and spread their message.	Social media allows grass roots movement to more easily mobilize and spread awareness across large groups of people.
7179_5816	goldLabel	a2	save time in your work. you can do more missions because you can easily connect withe people that you need to connect with, or people that can help you.	Social media brings more good than harm because it lets people share their art and music, especially for people who would have been excluded from those industries in past decades.
6927_5842	goldLabel	a1	Gives the ability to maintain contact across distances. This allows people to move (for example to at better job) without losing their emotional support network	Social media is a platform with very fast information dispersion, such that small artists can develop followings and become famous even without a lot of initial social capital.
6461_6836	goldLabel	a2	Social media connects between celebrities to their fan base, making them less “god like” and promoting people to follow them in a more positive way.	Social media offers a safe space for individuals which do not fit in their immediate environment: LGBT youth, disabled people, immigrants etc.
6039_5821	goldLabel	a1	Social media allows for easily accessible information about a variety of topics like politics and science, leading to a more informed populace.	Social media brings more good than harm because it brings people joy, or they would not keep using it in such large numbers.
5802_6081	goldLabel	a2	Social media connects immediately people who live far apart. You can follow your friends and family from afar and improve your relationships with them.	Social media brings more good than harm because it is a powerful tool to fight social isolation, which is damaging to one's physical and mental well-being, especially for house-bound people.
5869_6098	goldLabel	a1	Social media allows for fast communication during environmental and social crises (people can mark themselves safe or let their friends know how things are progressing).	Many revolutions globally have utilized social media as a platform for organization and communication. This allowed for the greater success and solidarity of these movements.
7209_6722	goldLabel	a2	Social media allows people to share their ideas to a wider platform of people, meaning they can get more support even if they can afford an a in a newspaper.	Social media allows for a vast number of people to connect and raise their awareness on issues in the world that they would otherwise not be aware of.
6338_5802	goldLabel	a2	social media served as a stage for social change driven by common people (eg. ALS ice bucket challenge, #MeToo movement)	Social media connects immediately people who live far apart. You can follow your friends and family from afar and improve your relationships with them.
6269_7194	goldLabel	a1	Social media contributes to world globalisation.people from all around the world can be in contact and exchange knowleg and information on their well being.	The perception of closeness obtained through social media can be as powerful as actual contact for mitigating loneliness and depression.
6867_6050	goldLabel	a2	Social media has allowed for the connections between families and friends that haven't been able to have other forms of communication open due to geographical barriers.	Social media allows people who are secluded in their communities, such as closeted gay youth in homophobic communities, to easily find anonymous support structures that help them get through difficult circumstances.
6195_5952	goldLabel	a1	Social media brings more good than harm because it helps businesses to promote themselves that might not have been able to advertise and succeed using older technologies.	I will always find supportive communities on social media and affectionate people to any situation I'm in, so I'm less likely to be depressed and feel misunderstood
5743_5819	goldLabel	a1	"Various platforms have created an option to ""check-in""during disasters, allowing loved ones to know you're safe more easily and without using up a lot of bandwidth, which is very valuable in a crisis"	Social media is a great way to spread your ideas and the things you are working on, from the comfort of your home you can access and influence the whole wide world.
5997_6992	goldLabel	a2	Social media makes easier to reach a wide platform of people, meaning it's easier to grow audience, for example, for a new newspaper or a blog.	Social media provides a unique way for in-the-closet LGTBs living in conservative areas to be part of virtual communities and communicate with other people like them.
7237_7010	goldLabel	a1	Social media allows for people with social limitations such as anxiety to make connections or online friends thus lessening their loneliness.	Social media allows us to gather support for important causes, allowing to disenfranchised communities to gain popular support they would never get otherwise
6303_6692	goldLabel	a1	Social media brings more good than harm because it allows people to communicate with others whom they would never have met previously.	Social media can make people feel better about themselves when they got likes on their photos or posts.
6577_7266	goldLabel	a1	Social media creates a platform for social activists to find supporters and thus create bigger social movements leading to social changes.	Investigative journalists has been rehabilitated as individuals share news more readily over social media, creating higher ad revenue and incentivizing people to purchase subscriptions.
6578_7221	goldLabel	a2	people can connect between themselves in an easier way than without social media.	Social media is the greatest repository of demographic data ever collected.
5945_5997	goldLabel	a1	Social Media gives people a place to form support groups, those who want to help can easly find people who need help by forming groups and offering advices.	Social media makes easier to reach a wide platform of people, meaning it's easier to grow audience, for example, for a new newspaper or a blog.
6800_7170	goldLabel	a2	Social media are a helpful tool that is no more harmful than any other modern technology. Banning is not the solution.	Social media allows individuals who may otherwise not be able to connect to be able to easily interact.
6612_6159	goldLabel	a1	Social media improves communication between friends and family members who live far away from each other.	Social media helps small businesses to advertise themselves more cheaply and more directly to potential clients, benefiting both businesses and consumers.
7251_6312	goldLabel	a2	Social media communication services create an infrastructure for organizing protests against aggressive governments.	Social networks help connect between people and reduces loneliness
6908_6003	goldLabel	a1	Social media helps people stay connected with more friends, even if they are far away.	Social networks help coordinate between people against an oppressive regime
6802_6039	goldLabel	a1	Social media connects people otherwise might not have met. thanks to social media we see new romantic, employment etc. opportunities. for many people.	Social media allows for easily accessible information about a variety of topics like politics and science, leading to a more informed populace.
6849_6954	goldLabel	a1	Using social media people can express their ideas and opinions better, even on less mainstream subjects, and find other people who think like them	Social media allows people to share relevant life events with the people they care about without having to go through and send it to each person individually.
6823_6954	goldLabel	a2	Social IT allows people which are marginalized and ignored by mainstream media to have a voice, that is potentially heard by the entire population.	Social media allows people to share relevant life events with the people they care about without having to go through and send it to each person individually.
6074_7209	goldLabel	a1	Social media is an immediate way to connect with people near and far without the limitation of physical distance or the unreliability of postal services.	Social media allows people to share their ideas to a wider platform of people, meaning they can get more support even if they can afford an a in a newspaper.
5907_6308	goldLabel	a2	Social media is a massive industry which employs tens of thousands of workers.	Social networks help people discover ideas they wouldn't discover otherwise such as minority media
6653_5869	goldLabel	a2	Social media is used to reach a vast number of people and can bring public attention to charities and causes that rely on people's contributions.	Social media allows for fast communication during environmental and social crises (people can mark themselves safe or let their friends know how things are progressing).
6577_6656	goldLabel	a1	Social media creates a platform for social activists to find supporters and thus create bigger social movements leading to social changes.	Social media allows politicians to connect with the public, providing the public with better and more reliable information about them.
6802_6843	goldLabel	a2	Social media connects people otherwise might not have met. thanks to social media we see new romantic, employment etc. opportunities. for many people.	Social media allows for a platform where everyone can freely express their thoughts and opinions, allowing for the maximized attainment of free speech.
6582_5943	goldLabel	a1	Social media allows people to crowd source ideas and trade information so that individuals with different skills can connect and create better products.	Politicians have a better understanding of their voters through social media and can realize better what they should do in order to create a change for the best
5802_7210	goldLabel	a1	Social media connects immediately people who live far apart. You can follow your friends and family from afar and improve your relationships with them.	Social media provides an avenue for crowd-funding for charity or a personal cause that can reach a wider audience much faster.
6908_6289	goldLabel	a1	Social media helps people stay connected with more friends, even if they are far away.	"Social media make people feel happier about their lifes: they share things they done and get ""likes"" for them."
7194_5997	goldLabel	a1	The perception of closeness obtained through social media can be as powerful as actual contact for mitigating loneliness and depression.	Social media makes easier to reach a wide platform of people, meaning it's easier to grow audience, for example, for a new newspaper or a blog.
6579_7233	goldLabel	a1	Social media provides a platform for more direct to the public sources of news and information which can lead to a more informed populous when it comes to their important issues.	Democracy is based on the ability of people to hear and evaluate different views and opinions about the world. before social media people where exposed only to small amount of opinions, backed by news organizations.
6312_6908	goldLabel	a2	Social networks help connect between people and reduces loneliness	Social media helps people stay connected with more friends, even if they are far away.
5965_6037	goldLabel	a1	Social media is an effective mechanism by which social movements can gain attention - for example, it often enables the spread of messages or awareness about protest movements in other countries.	Social media help entertain us in our empty time. If in the past we spent a lot of time doing nothing, now we can easily catch up with our friends or look at cat video.
6662_6784	goldLabel	a1	Social media is a direct platform to interact with the end user who could be the person based on the need which makes the things happen so quickly compared to manual effort.	Social media is a cheap and always on medium for me to connect with near and dear whenever I wish. How can that bring harm?
5888_6436	goldLabel	a1	Social media has connected the world on a scale beyond any form of communication in the past.	Social media can help shy or closed in people reach out and establish electronic relationships with others.
6730_6523	goldLabel	a2	Social media itself can foster active discussion around topics of mutual interest.	Social media can allow friends and family members to more actively stay aware of each other's life events.
6606_6102	goldLabel	a2	Social media has allowed participants in obscure interests to organize and do more impressive things by enabling connections	Social media allows people from across the globe to interact with each other in ways that could not have been possible before.
7236_7131	goldLabel	a1	They do more good than harm. The benefits of social media through interconnectivity, social empathy far outweigh the negative tendencies of some users	When used to communicate important safety and security information, whether nature or man made events, social media is helpful. But personal info security needs significant improvements.
6517_6832	goldLabel	a2	Social media is a way for long-lost friends, classmates or family members to reconnect.	Social media helps the elderly feel less isolated.
7019_6483	goldLabel	a2	tweeter publish a lot of interesting news content that is exclusive.	Social media allows you find long-lost friends and family members.
6073_5882	goldLabel	a1	Social Media is a convenient means of eliciting the feelings of people and also understanding the impact of events on the populace	Social media allows people to keep in touch with many weak ties, and thus increases their social capital
7132_5891	goldLabel	a1	If you know how to filter data on social media, the good is increased. Such as: bring people together, you can meet others with same interest. Work together. Build good solutions for the world	Use of Social Media is a personal choice, and therefore most negative experiences can be controlled by the individual, and often brings more positive outcomes than bad.
6734_6456	goldLabel	a2	Social media embrace the fact that information should be free to share and allow people to express themselves.	Social media helps people share about their lives and connect with others.
6861_5954	goldLabel	a2	Social media allows me to find people with similar interests	Social Media connecting people on the whole world.
6166_6881	goldLabel	a2	Social media is and added advantage in creating international policies based on the events for government. and finding new markets for corporates like how trades and cross border currency are impacted	Social media just like any other technology can be leveraged for the greater good of individuals or group of individuals. Ex. Bring like minded people together, sharing idea, inspiring each other etc.
6054_6483	goldLabel	a2	Social media helps individuals build a public image	Social media allows you find long-lost friends and family members.
7239_6894	goldLabel	a1	We can stay connected and feel safer in this world wherever we are. Friends and Family are a text message away. Instant communication allows for more efficient use of our time and share in lifes moments	In case of jallikattu or sterlite - there was a huge effect of media in gathering/uniting people for fighting against the Government laws and won their right. When used properly, social media brings good.
6432_7236	goldLabel	a2	Social media are an ideal platform for brands to spread their messages in an other way and to build on the reach of the influencers on such media.	They do more good than harm. The benefits of social media through interconnectivity, social empathy far outweigh the negative tendencies of some users
6138_7239	goldLabel	a2	Though it may cause or enable vanity, social media connects families from all over the world and if it is used carefully, it can be a wonderful tool for communication.	We can stay connected and feel safer in this world wherever we are. Friends and Family are a text message away. Instant communication allows for more efficient use of our time and share in lifes moments
7270_6310	goldLabel	a2	The connections we make in real life are often lost without the assistance of social media. It's enables us to enrich our lives and foster more diverse friendships when we aren't limited by geography.	Social Media has provided platform for cultural globalization. with social media not people connect across globe and different cultures and are able to understand each culture much better.
6570_6192	goldLabel	a2	Anything that connects people together cant be bad	Due to social media, businesses are compelled to provide better and timely customer support.
6449_7044	goldLabel	a2	The harms of social-media will generally pale before the benefits because unwanted communication is so easy to block.	Social Media allows to connect people around the globe as easy as it can be.
5951_5793	goldLabel	a1	Social media allow for extended network and unrestricted communication across the globe	OPENS UP THE WORLD WITH NEWS/POLITICS/SPORTS/SCIENCE/PHOTOGRAPHY/ENTERTAINMENT/ TOURISM TO GENERAL PEOPLE.
5741_5931	goldLabel	a1	Social media provides a platform for debate and truly open discussion.	Network with employees of other companies for mutual benefit.
7187_5734	goldLabel	a1	Recent events in France with the 'Yellow Vests' movement is an example of how social media can empower people to be heard, when public opinion seem to have no more impacts on governments actions.	I think it depends on the platform. Example - I find out information on business much sooner than I used to before. As a customer, I am able to express satisfactions/concerns more directly and timely also.
7043_7104	goldLabel	a1	Social media allows us to see posts from our elected officials, this direct communication in theory allows the voter to see which candidate best represents their views.	Social media can be a very good source of information, business ideas as well as social relations. It is up to the user to believe/verify/reject any information.
7013_6339	goldLabel	a1	Social media provides an outlet, and a connection, for people who wish to reach out beyond their immediate circle fo acquaintances. This can boost their happiness, and their mental health, by reducing feelings of isolation.	It is a great enabler if used for its intended purpose. There are so many voices in our society and the world at large that would never have been heard from if not for social media.
6657_5868	goldLabel	a1	Social media provides great scope for innovation where it is easy to collaborate and brainstorm on different ideas.	Keeps people in touch in ways they weren't able to before.
6649_7162	goldLabel	a1	Social media provides a platform for friends and family to easily and efficiently post updates in one place that everyone connected to them can then consume	The easiest way to know about what is going on in the world is with social media. Social movements like #MeToo thrived on social media. Could not have done it otherwise.
6827_6416	goldLabel	a1	Social media helps in being upto date with the developments that are happening all around the world. And how to update ourselves with the world as it evolves.	Social Media actually has a lot of pros that I do believe weigh out the cons. Social media actually helps others to communicate even if they are many kilometres away from each other.
7131_6266	goldLabel	a1	When used to communicate important safety and security information, whether nature or man made events, social media is helpful. But personal info security needs significant improvements.	You can post your creative skills through videos, photos and display your skills to the whole world through social media.
6496_5981	goldLabel	a1	Social media gives everyone a voice and right to express their opinion on an equal setting	Social Media often reflects the real life activities of real people
6667_6873	goldLabel	a2	Social Media make personal world wide and bring person to unknown world	Today's society media is making people happy by connecting people anytime, anywhere
5951_6021	goldLabel	a1	Social media allow for extended network and unrestricted communication across the globe	Social media saves postal and telecomms costs for example for birthday and christmas cards
5927_6330	goldLabel	a2	For business promotions, social media is a better and cost effective platform.	Social Media has a positive impact on marketing for clients. It is inexpensive and hits the masses.
6809_7276	goldLabel	a2	Easy to build communities with people with whom you share the same interests ie. work community or housing area community	Social media allows people with real life social interaction issues to approach and talk to people they wouldn't usually have the courage to do by themselves.
6358_6888	goldLabel	a2	it is yet another mean of contact with friends	Social Media gives business platform to interact with their customers faster.
6470_6192	goldLabel	a2	Social media can be fun and informative when used as such	Due to social media, businesses are compelled to provide better and timely customer support.
6852_7204	goldLabel	a2	It is a good tool to bring friends and family together. Value is in identifying lost friends.	Social media has allowed reconnection with long lost friends and relatives.
6062_6540	goldLabel	a2	People can see more details about you and can judge positively	Social media reduces loneliness of people who are socially isolated.
6537_6341	goldLabel	a2	We should promote the correct usage of social media, rather than banning it or discontinuing it in any way. People should develop the brilliance to use any platform in a constructive way	Being a better person is about compassion and empathy. And there is nothing that increases cross-world empathy like social media. From Africa to Arizona, I can deeply understand the human condition. Thank you, Facebook.
6735_5954	goldLabel	a1	Social media helps people connect across physical limitations	Social Media connecting people on the whole world.
6310_6810	goldLabel	a1	Social Media has provided platform for cultural globalization. with social media not people connect across globe and different cultures and are able to understand each culture much better.	Social media, when authentic (and, at times, even when filled with lies), brings the humanness in our humanity. It now serves science, policy-making and justice.
5884_6514	goldLabel	a2	Helps in knowing out the diffrerent issues over the globe	Social media is an incredible source of diverse opinions, creative ideas and authentic discourse.
7063_6546	goldLabel	a1	Social media helps lonely people find friends with common interests even on the other side of the globe.	Social media is equally accessable to everyone. It opens up the world.
