id	annotatorid	label	a1	a2
6664_5736	goldLabel	a2	Social Media allows to equally and exponencially distribute knowledge among the people in a non-costly and timeless way	Social media is simply enabling communication, which is always a good thing.
6099_6344	goldLabel	a1	Social media has given a platform to common man to express themselves. This has lead to many revolutions and positive changes to many lives and therefore society.	With Social Media Business can connect to users better and provide services as per individual needs not based on segmentation.
6893_5732	goldLabel	a2	in developing country like Inida where mobile data is cheap social media has helped in small business and freelancers to promote their stuff. FB, Instagram and What's app are used widely.	Social media reduced the gap between public and government services. Public are able to reach out to authorities quickly and able to find solutions for them
6607_7143	goldLabel	a2	Social Media is good as you know the status of how your friends are doing and what going on in their lives	Social media can help people maintain connections with people and groups such as old school classmates and former neighbors, expanding their social connections.
5828_6000	goldLabel	a2	It connects the world in a way that change for good can take hold faster.	Social media has brought about information at our fingertips - helping us find the right contact via media such as LinkedIn
5921_7270	goldLabel	a1	Social media has given minorities a safe and discreet place to meet and discuss issues important to them. It has empowered these groups to demand changes in real life, making society better and safer for all.	The connections we make in real life are often lost without the assistance of social media. It's enables us to enrich our lives and foster more diverse friendships when we aren't limited by geography.
6649_6344	goldLabel	a1	Social media provides a platform for friends and family to easily and efficiently post updates in one place that everyone connected to them can then consume	With Social Media Business can connect to users better and provide services as per individual needs not based on segmentation.
6238_7003	goldLabel	a1	Social media gives a voice to everyone, without any distinction	Social media has enabled discovery of interests participants may not even have known they have
7139_5828	goldLabel	a1	Social media, if rightly used, can help in connecting with people who can help both personally and professionally.	It connects the world in a way that change for good can take hold faster.
7023_5858	goldLabel	a1	Social media provides an opportunity for everybody's voice to be heard, irrespective of their background, race, gender or religion.	one is able to reconnect and continue interaction with long lost/old friends
6864_6472	goldLabel	a1	social media has provided a platform where the voices of unheard can be heard	Social media when used responsibly can be a boon to one and all
6298_6505	goldLabel	a2	There are good lessons learnt can be used for better purpose and quick benefit of the society using social media.	Social media is a natural extension of the way people have always interacted freely with each other, thus it can only bring good outcomes
6485_5734	goldLabel	a1	Used correctly and with a critical eye as to what one is reading, social media can keep distant friends 'involved' in our lives; they can stay up to date with your latest adventures.	I think it depends on the platform. Example - I find out information on business much sooner than I used to before. As a customer, I am able to express satisfactions/concerns more directly and timely also.
6685_6576	goldLabel	a1	Social media helps us to find or learn about literally anything.	If one understand their accountability and responsibility of their own activities, it reaps benefits.
6625_6616	goldLabel	a1	The social nature of social media helps to remove bias from news.	Targeted advertising based on social media analytics can provide opportunities for users to satisfy their current needs and interests.
6840_7056	goldLabel	a1	It is easy for small businesses to create a social media page and advertise themselves rather than needing to develop a special web site.	It is a powerful tool to voice one's opinion and bring to forefront what you think requires attention.
6236_7081	goldLabel	a2	Social media is a platform for information sharing that is not as easily manipulated by government as traditional media.	Social Media has helped saved many lives by immediately connecting with support systems and reaching out for timely help
6625_5868	goldLabel	a1	The social nature of social media helps to remove bias from news.	Keeps people in touch in ways they weren't able to before.
5891_6164	goldLabel	a2	Use of Social Media is a personal choice, and therefore most negative experiences can be controlled by the individual, and often brings more positive outcomes than bad.	Part of being a human being is feeling connected. Social media helps keep us from becoming isolated as we age and our social contact wanes.
6864_7081	goldLabel	a2	social media has provided a platform where the voices of unheard can be heard	Social Media has helped saved many lives by immediately connecting with support systems and reaching out for timely help
7137_7097	goldLabel	a1	Social media is a very effective tool for mobilizing disorganized individuals into various forms of protest, either online or on the streets. This gives significantly more power to citizens and improves democracy and accountability.	Social media empower people, enhancing their ability to communicate one with another. Some people may abuse this ability, but generally it brings much more good than harm.
6192_6062	goldLabel	a1	Due to social media, businesses are compelled to provide better and timely customer support.	People can see more details about you and can judge positively
6505_6363	goldLabel	a1	Social media is a natural extension of the way people have always interacted freely with each other, thus it can only bring good outcomes	The internet gives millions of people access to information they would not otherwise have had, which is a huge benefit. Most people are not that easy to fool.
7031_6874	goldLabel	a1	Social media help to bring people who may physically not be able to see on a regular basis to keep in touch and have at least a general view on how things are going.	Social media, if we choose to use it judiciously, offers tremendous opportunity to engage with family, friends and community at large across the world and express our views in an unprecedented manner.
7013_6842	goldLabel	a1	Social media provides an outlet, and a connection, for people who wish to reach out beyond their immediate circle fo acquaintances. This can boost their happiness, and their mental health, by reducing feelings of isolation.	Social media helped us to be connected with our friends and relatives and also with colleagues and their life updates. It helps to make new connections also. Some important news are shared on Social Media.
5750_7151	goldLabel	a2	How easy it is now, to share what I want to share, and what I want to see. If I am a sane person, I can still use the platform judiciously.	Social media has connected more people than ever before and that is always a good thing. When people are connected and share, more good than bad happens.
6691_6156	goldLabel	a1	Social media can be used to communicate important information to a wide audience. Like informing friends and family know about major life events.	Social media exposes its users to feel-good stories and acts of kindness that have a positive ripple effect.
6817_6829	goldLabel	a1	Social media allows people to quickly communicate, to keep up with friends and what is going on in their lives - where people ensure they only share information to their friend/family circles.	Social media allows you to define yourself in your own terms, allows you to control the messaging for your personal brand, and allows you to share your optimism and positive energy with the world at-large.
6979_6407	goldLabel	a2	Social media ia great. We all like it.	Trends of social behavior can be studied for business purposes and generating new product ideas.
6607_7228	goldLabel	a1	Social Media is good as you know the status of how your friends are doing and what going on in their lives	Social media allows people to self organise and protest against opression. The arab spring was a great example of this.
6156_6226	goldLabel	a2	Social media exposes its users to feel-good stories and acts of kindness that have a positive ripple effect.	Social media allows distant families and friends to stay connected and share their lives in a convenient and fun way
6435_6073	goldLabel	a2	Best way of timepass. You will get stuffs from all around the world starting from jokes, news, update on your friends.	Social Media is a convenient means of eliciting the feelings of people and also understanding the impact of events on the populace
6941_5927	goldLabel	a1	Social media enables global communication and activism towards good causes	For business promotions, social media is a better and cost effective platform.
5990_7157	goldLabel	a1	Social media helps people to better understand all of the various points of view on a topic - allowing them to make decisions that are good for more people.	Social media is the world in a platform. People love to talk,opine share,appreciate each other since time immemorial. Social media brings them closer, form groups, stay connected and enjoy togetherness in all inclusive manner.
7116_7238	goldLabel	a1	Social Media allows us to easily connect with loved ones.	Social media do allow people to re-connect valuable relationships both in personal life and in business.
7126_5960	goldLabel	a1	Social media can be used to quickly mobilize large numbers of people for good after disasters or personal tragedies as seen in the many charitable gofundme campaigns.	It is the hallmark of the digital age making the world a smaller place. Its primary intention helps gives people new, better and easier means to communicate, network and collaborate, notwithstanding the unintended consequences.
6248_7031	goldLabel	a2	SM brings the information, knowledge that you can never have before, the news feed is based on what you're interested in &amp; the people you follow, so it's you who decide whether it's harmful or not	Social media help to bring people who may physically not be able to see on a regular basis to keep in touch and have at least a general view on how things are going.
6075_6363	goldLabel	a1	Social media has provided platform to common people to voice their opinion on various subjects which otherwise was left to regulated agencies like press etc	The internet gives millions of people access to information they would not otherwise have had, which is a huge benefit. Most people are not that easy to fool.
6767_6238	goldLabel	a2	social media can become an activist platform to amplify minority thoughts to mainstream ideas	Social media gives a voice to everyone, without any distinction
5927_6229	goldLabel	a1	For business promotions, social media is a better and cost effective platform.	Social media can easily be used to reach a large audience
6694_6416	goldLabel	a2	Provides a platform for all kinds of connections to occur. These kinds of platforms have brought families, various groups and other common denominations together that would not have been possible.	Social Media actually has a lot of pros that I do believe weigh out the cons. Social media actually helps others to communicate even if they are many kilometres away from each other.
7247_7131	goldLabel	a1	Social media is an instrument that provides the right to normal people to get connected to powerful politicians and people to directly interact. This medium was no there before.	When used to communicate important safety and security information, whether nature or man made events, social media is helpful. But personal info security needs significant improvements.
6789_6363	goldLabel	a1	Social media is the quickest way to reach out for any kind of help specially in case of emergencies.For eg. in India people traveling in trains are using Twitter to reach out for any support.	The internet gives millions of people access to information they would not otherwise have had, which is a huge benefit. Most people are not that easy to fool.
5729_6885	goldLabel	a1	Social Media brings more good than harm based on what you are looking for and what level of information you are willing to share, example, they can centralize your trusted news source.	We see issues like Me-too movements are getting reported in social media. All mismanagement gets immediately reported in social media now a days. Social media platform has evolved as defender of justice for human society.
5948_6226	goldLabel	a2	social media helped the #metoo movement and changed the conversation for women in the workplace	Social media allows distant families and friends to stay connected and share their lives in a convenient and fun way
6166_7247	goldLabel	a2	Social media is and added advantage in creating international policies based on the events for government. and finding new markets for corporates like how trades and cross border currency are impacted	Social media is an instrument that provides the right to normal people to get connected to powerful politicians and people to directly interact. This medium was no there before.
6226_6985	goldLabel	a1	Social media allows distant families and friends to stay connected and share their lives in a convenient and fun way	Social networks are a non-intimidating way for people with social anxiety to connect with others
6638_7132	goldLabel	a1	Social media allows people to connect with likeminded individuals from anywhere in the world. This gives people more fulfillment in their lives, and is especially important for minorities who suffer from varying degrees of oppression.	If you know how to filter data on social media, the good is increased. Such as: bring people together, you can meet others with same interest. Work together. Build good solutions for the world
6607_7275	goldLabel	a2	Social Media is good as you know the status of how your friends are doing and what going on in their lives	Social media provides easier access to relatives and friends that were lost out of sight
6805_6445	goldLabel	a2	Social media doesn't bring harm. It is users using it for private. It is good for instant messaging and crowdsourcing. What if we had the tool that could determine if a message is private?	Social media fosters connection in this high paced society and being social animals we need to be connected to others with similar or opposing ideas. It helps in evaluating both pros and cons of any matter.
7003_6102	goldLabel	a2	Social media has enabled discovery of interests participants may not even have known they have	Social media allows people from across the globe to interact with each other in ways that could not have been possible before.
6805_5857	goldLabel	a2	Social media doesn't bring harm. It is users using it for private. It is good for instant messaging and crowdsourcing. What if we had the tool that could determine if a message is private?	Social media allows anyone with internet access to have a voice. Not everyone can speak on TV or write for a newspaper, but social media allows multitudes to post their thoughts and ideas.
6320_6705	goldLabel	a1	Social media was used during terror attacks to help save lives	The internet is better than sitting in front of the TV, at least you might learn something.
6893_7276	goldLabel	a2	in developing country like Inida where mobile data is cheap social media has helped in small business and freelancers to promote their stuff. FB, Instagram and What's app are used widely.	Social media allows people with real life social interaction issues to approach and talk to people they wouldn't usually have the courage to do by themselves.
6571_7063	goldLabel	a2	You can find people all around the globe and connect to them, even if you have lost contact to them long time ago.	Social media helps lonely people find friends with common interests even on the other side of the globe.
6670_7143	goldLabel	a2	Social media is a good way of keeping track and up today with the happenings of friends, family, and colleagues over time.	Social media can help people maintain connections with people and groups such as old school classmates and former neighbors, expanding their social connections.
6864_6383	goldLabel	a2	social media has provided a platform where the voices of unheard can be heard	Social media can allow citizens to voice their opinions publicly by bypassing the old media which is controlled by interest groups.
6933_6266	goldLabel	a1	Social media provides an easy way for everyone to express their true views.	You can post your creative skills through videos, photos and display your skills to the whole world through social media.
6062_5754	goldLabel	a1	People can see more details about you and can judge positively	New ways to consume media inspires new content on each respective platforms
5857_7137	goldLabel	a2	Social media allows anyone with internet access to have a voice. Not everyone can speak on TV or write for a newspaper, but social media allows multitudes to post their thoughts and ideas.	Social media is a very effective tool for mobilizing disorganized individuals into various forms of protest, either online or on the streets. This gives significantly more power to citizens and improves democracy and accountability.
7137_6444	goldLabel	a1	Social media is a very effective tool for mobilizing disorganized individuals into various forms of protest, either online or on the streets. This gives significantly more power to citizens and improves democracy and accountability.	With social media, we can keep ourselves abreast. It's up to individual what to follow and what not to follow, what to believe and what not to believe.
6636_6586	goldLabel	a1	Social media democratizes access to information and exchange of ideas between individuals. This promotes community awareness of their current situation and future possibilities.	Social Media provides access to research materials instantly as opposed to significant labour intensive data gathering
7279_7068	goldLabel	a2	Social media depends on how individuals use. This means that we have many opportunities to gain various benefits from SM.	Communication is a breeze with social media. What would take forever to disseminate takes exponentially less time to get across the globe.
6773_6830	goldLabel	a2	Social media as a way to learn more about diverse life styles from people of different backgrounds	Social media is a great way to connect with distant friends and family, sharing photos and stories with people they cannot regularly connect with.
7264_6805	goldLabel	a1	Many of us are too shy to engage in public discussions. Social media allows us to be part of debates by allowing us to carefully choose our words and hone our explanations before we express them.	Social media doesn't bring harm. It is users using it for private. It is good for instant messaging and crowdsourcing. What if we had the tool that could determine if a message is private?
7126_6537	goldLabel	a1	Social media can be used to quickly mobilize large numbers of people for good after disasters or personal tragedies as seen in the many charitable gofundme campaigns.	We should promote the correct usage of social media, rather than banning it or discontinuing it in any way. People should develop the brilliance to use any platform in a constructive way
6451_6188	goldLabel	a2	Many a times it happened that, different consumer companies are addressing your complain quicker when it is posted on social media, rather than going through formal process.	There is a lot that can be learned and discovered on social media, and often it is easier to find things on social platforms than on the internet
6166_7126	goldLabel	a2	Social media is and added advantage in creating international policies based on the events for government. and finding new markets for corporates like how trades and cross border currency are impacted	Social media can be used to quickly mobilize large numbers of people for good after disasters or personal tragedies as seen in the many charitable gofundme campaigns.
7143_6344	goldLabel	a1	Social media can help people maintain connections with people and groups such as old school classmates and former neighbors, expanding their social connections.	With Social Media Business can connect to users better and provide services as per individual needs not based on segmentation.
6566_7245	goldLabel	a2	Social media allows people to follow their idols and their whereabouts.	Social media allows people to stay in touch, even though they live in opposite parts of the world.
6341_6248	goldLabel	a2	Being a better person is about compassion and empathy. And there is nothing that increases cross-world empathy like social media. From Africa to Arizona, I can deeply understand the human condition. Thank you, Facebook.	SM brings the information, knowledge that you can never have before, the news feed is based on what you're interested in &amp; the people you follow, so it's you who decide whether it's harmful or not
6625_6062	goldLabel	a1	The social nature of social media helps to remove bias from news.	People can see more details about you and can judge positively
7270_6545	goldLabel	a2	The connections we make in real life are often lost without the assistance of social media. It's enables us to enrich our lives and foster more diverse friendships when we aren't limited by geography.	Social Media is a wonderful place only if the choice of friends or connections made are right and there is some sort of basic similarity between you and the one who views your shares.
7270_7132	goldLabel	a1	The connections we make in real life are often lost without the assistance of social media. It's enables us to enrich our lives and foster more diverse friendships when we aren't limited by geography.	If you know how to filter data on social media, the good is increased. Such as: bring people together, you can meet others with same interest. Work together. Build good solutions for the world
6062_6400	goldLabel	a2	People can see more details about you and can judge positively	Social media is a good platform for people to stay in touch and on top of trends.
6796_5732	goldLabel	a1	Social media is ensuring more of public good by creating awareness when properly verified and validated. Given is false news is restricted	Social media reduced the gap between public and government services. Public are able to reach out to authorities quickly and able to find solutions for them
6546_7108	goldLabel	a1	Social media is equally accessable to everyone. It opens up the world.	Social Medias can make relatives closer with instant news and photos.
6444_6645	goldLabel	a2	With social media, we can keep ourselves abreast. It's up to individual what to follow and what not to follow, what to believe and what not to believe.	Social media allows people to find and connect to old friends and relatives that they haven't seen in a long time.
7127_5785	goldLabel	a1	Social media fosters community engagement, giving a platform to people who might otherwise not have the ability.	Social media opens doors to new communities that can lend people an increased sense of purpose.
6238_6675	goldLabel	a1	Social media gives a voice to everyone, without any distinction	Its an easy and fast way to be updated on your in interest topics
6789_6885	goldLabel	a1	Social media is the quickest way to reach out for any kind of help specially in case of emergencies.For eg. in India people traveling in trains are using Twitter to reach out for any support.	We see issues like Me-too movements are getting reported in social media. All mismanagement gets immediately reported in social media now a days. Social media platform has evolved as defender of justice for human society.
5989_6432	goldLabel	a1	Social media allows to explore virtually any interest, connection, creed and people knowledge without biased or restriction of any kind, openly.	Social media are an ideal platform for brands to spread their messages in an other way and to build on the reach of the influencers on such media.
7228_6670	goldLabel	a2	Social media allows people to self organise and protest against opression. The arab spring was a great example of this.	Social media is a good way of keeping track and up today with the happenings of friends, family, and colleagues over time.
6767_6595	goldLabel	a1	social media can become an activist platform to amplify minority thoughts to mainstream ideas	Social media allowed important movements like 11-M, in Spain, which gave more voice to the people
6649_7131	goldLabel	a1	Social media provides a platform for friends and family to easily and efficiently post updates in one place that everyone connected to them can then consume	When used to communicate important safety and security information, whether nature or man made events, social media is helpful. But personal info security needs significant improvements.
6061_5916	goldLabel	a1	Social media allows people to keep in touch with their loved ones who are far away from them.	Using sparingly, social media helps connecting people together, across boundaries of frontiers, time zones, languages, and backgrounds. It really saves time in that respect.
