id	annotatorid	label	a1	a2
6881_6397	goldLabel	a1	Social media just like any other technology can be leveraged for the greater good of individuals or group of individuals. Ex. Bring like minded people together, sharing idea, inspiring each other etc.	A good platform for a common man to reach to their leaders to raise voice for noble cause. Which was near to impossible in past. It should be tied to policy and guidelines to avoid misuse.
7239_7073	goldLabel	a1	We can stay connected and feel safer in this world wherever we are. Friends and Family are a text message away. Instant communication allows for more efficient use of our time and share in lifes moments	I witnessed Social media significant contributions to bring democracy and free speech to my beloved Tunisia when it was governed by dictators for way too long. Thus Social media brings more good than harm.
6886_6904	goldLabel	a1	Social media provides a broad platform that provides a voice to underserved populations	Its a good way to make money reducing expenses
6373_6477	goldLabel	a1	Social media has opened up a different world and has brought economic, social and cultural benefits to the world. Openness and transparency have increased as a result of social media	Social good - Social media is a reflection of our society at large.. What you see in social media depicts the thoughts and norms of our current culture
6593_6435	goldLabel	a1	Social media is a reflection of the real world which brings good and bad. On the whole it brings the world closer together.	Best way of timepass. You will get stuffs from all around the world starting from jokes, news, update on your friends.
6842_6874	goldLabel	a2	Social media helped us to be connected with our friends and relatives and also with colleagues and their life updates. It helps to make new connections also. Some important news are shared on Social Media.	Social media, if we choose to use it judiciously, offers tremendous opportunity to engage with family, friends and community at large across the world and express our views in an unprecedented manner.
6138_7270	goldLabel	a2	Though it may cause or enable vanity, social media connects families from all over the world and if it is used carefully, it can be a wonderful tool for communication.	The connections we make in real life are often lost without the assistance of social media. It's enables us to enrich our lives and foster more diverse friendships when we aren't limited by geography.
6827_6435	goldLabel	a1	Social media helps in being upto date with the developments that are happening all around the world. And how to update ourselves with the world as it evolves.	Best way of timepass. You will get stuffs from all around the world starting from jokes, news, update on your friends.
7003_6093	goldLabel	a2	Social media has enabled discovery of interests participants may not even have known they have	It helps people to know about happenings on the world without a bias from media
6483_6985	goldLabel	a1	Social media allows you find long-lost friends and family members.	Social networks are a non-intimidating way for people with social anxiety to connect with others
6447_6363	goldLabel	a1	Social media allows the common people around the world to have access to new experiences otherwise reserved only for those who could travel abroad.	The internet gives millions of people access to information they would not otherwise have had, which is a huge benefit. Most people are not that easy to fool.
7011_5758	goldLabel	a1	Social media is extremely useful in connecting people to each other and vital, potentially lifesaving information during an emergency.	With social media, I connected with my friends, classmates, school mates and team mates. We share the opinions and discuss the topics our community focused.
6305_6593	goldLabel	a2	The only advantage of Social media is to express our thoughts at anytime. World has become small and you will be able to connect all leading people in the world.	Social media is a reflection of the real world which brings good and bad. On the whole it brings the world closer together.
5954_5949	goldLabel	a1	Social Media connecting people on the whole world.	social media is succeeding in bringing people who are physically apart
5918_6402	goldLabel	a2	I am able to connect with far-away relatives lifes. Independent of time of day.	Social media makes the world flatter, connecting us with people, cultures and experiences we would have never encountered otherwise.
7012_7187	goldLabel	a2	"Actually, It is about the ""content"" in the social media. As long as the social media serves as a good platform that accepts only good content then it its good."	Recent events in France with the 'Yellow Vests' movement is an example of how social media can empower people to be heard, when public opinion seem to have no more impacts on governments actions.
7043_7228	goldLabel	a2	Social media allows us to see posts from our elected officials, this direct communication in theory allows the voter to see which candidate best represents their views.	Social media allows people to self organise and protest against opression. The arab spring was a great example of this.
7108_6082	goldLabel	a2	Social Medias can make relatives closer with instant news and photos.	Social media provides a platform to democratize society if used properly.
6697_7113	goldLabel	a2	Social Media can be engineered to control bureaucracy via citizen feedback	Social media connects friends and relatives in different parts of the world.
6257_6468	goldLabel	a2	Sharing on social media can be a lot of fun for sharers and audience	Social media enables the ability to build community outside the constraints of physical location.
6796_6402	goldLabel	a2	Social media is ensuring more of public good by creating awareness when properly verified and validated. Given is false news is restricted	Social media makes the world flatter, connecting us with people, cultures and experiences we would have never encountered otherwise.
5732_7227	goldLabel	a2	Social media reduced the gap between public and government services. Public are able to reach out to authorities quickly and able to find solutions for them	Simple and nice way to keep up to date and communicate with family members that are close in life but far away in geography.
6505_6147	goldLabel	a1	Social media is a natural extension of the way people have always interacted freely with each other, thus it can only bring good outcomes	If used wisely, social media brings more good. The problem is about people not knowing how to use appropriately.
5758_6504	goldLabel	a1	With social media, I connected with my friends, classmates, school mates and team mates. We share the opinions and discuss the topics our community focused.	ability to express oneself without fear has allowed more and more folks to raise awareness on topics ignored by the mainstream media
6873_5851	goldLabel	a1	Today's society media is making people happy by connecting people anytime, anywhere	Information spread is faster than traditional way and it is less regulated.
6886_5918	goldLabel	a1	Social media provides a broad platform that provides a voice to underserved populations	I am able to connect with far-away relatives lifes. Independent of time of day.
6594_5891	goldLabel	a1	In my opinion providing voice to common man/women to highlight their day to day issue to concerned authorities has been one of the biggest advantages of Social media.	Use of Social Media is a personal choice, and therefore most negative experiences can be controlled by the individual, and often brings more positive outcomes than bad.
6638_6209	goldLabel	a1	Social media allows people to connect with likeminded individuals from anywhere in the world. This gives people more fulfillment in their lives, and is especially important for minorities who suffer from varying degrees of oppression.	The good far outweighs the negative. Social media is novel and evolving, which is scary. However, the benefits of linking people, business, and institutions together are enormous and are changing the world for the better.
6675_5989	goldLabel	a2	Its an easy and fast way to be updated on your in interest topics	Social media allows to explore virtually any interest, connection, creed and people knowledge without biased or restriction of any kind, openly.
7127_6734	goldLabel	a1	Social media fosters community engagement, giving a platform to people who might otherwise not have the ability.	Social media embrace the fact that information should be free to share and allow people to express themselves.
5899_6061	goldLabel	a2	Social media helps people get informed and connect, without the fuss of having to contact all of your friends and family every day or week.	Social media allows people to keep in touch with their loved ones who are far away from them.
6728_6697	goldLabel	a1	Social media is connecting people all over the world and making information travel faster than ever before.	Social Media can be engineered to control bureaucracy via citizen feedback
6147_5736	goldLabel	a2	If used wisely, social media brings more good. The problem is about people not knowing how to use appropriately.	Social media is simply enabling communication, which is always a good thing.
6416_6769	goldLabel	a2	Social Media actually has a lot of pros that I do believe weigh out the cons. Social media actually helps others to communicate even if they are many kilometres away from each other.	Social media can be a boon in event of disasters. It has been during many disasters that effective usage of social media could save lives or spread rightinformation to right people
7126_5944	goldLabel	a1	Social media can be used to quickly mobilize large numbers of people for good after disasters or personal tragedies as seen in the many charitable gofundme campaigns.	Social media provides one of the best forums for reconnecting with long-lost friends and family and allows people to remain close, even across vast distances.
6146_6363	goldLabel	a1	Social media platforms allow to more transparency of information as it reduces dependency on a small elite groups that see themselves as the owners of the truth for society.	The internet gives millions of people access to information they would not otherwise have had, which is a huge benefit. Most people are not that easy to fool.
6743_6187	goldLabel	a1	Social media gives voice to every single human being, like never before.	Social media opens a new way of interacting with other people and removes bias
5921_6341	goldLabel	a1	Social media has given minorities a safe and discreet place to meet and discuss issues important to them. It has empowered these groups to demand changes in real life, making society better and safer for all.	Being a better person is about compassion and empathy. And there is nothing that increases cross-world empathy like social media. From Africa to Arizona, I can deeply understand the human condition. Thank you, Facebook.
5831_5897	goldLabel	a1	Social media pushes formerly secretive organizations to be more transparent and accountable.	Social media reaches many user groups that would otherwise not have been addressed.
5754_5951	goldLabel	a2	New ways to consume media inspires new content on each respective platforms	Social media allow for extended network and unrestricted communication across the globe
6022_6213	goldLabel	a1	Social media allows house-bound elderly people, and other immovable people, to pseudo-interact with others.	Social Media allows you to see pictures of far away relatives quickly.
5734_6881	goldLabel	a2	I think it depends on the platform. Example - I find out information on business much sooner than I used to before. As a customer, I am able to express satisfactions/concerns more directly and timely also.	Social media just like any other technology can be leveraged for the greater good of individuals or group of individuals. Ex. Bring like minded people together, sharing idea, inspiring each other etc.
7116_6586	goldLabel	a1	Social Media allows us to easily connect with loved ones.	Social Media provides access to research materials instantly as opposed to significant labour intensive data gathering
7279_6760	goldLabel	a2	Social media depends on how individuals use. This means that we have many opportunities to gain various benefits from SM.	Social media allows charitable organizations to show their work and stay connected with both those that support them and those who may be interested in supporting them.
6213_6465	goldLabel	a2	Social Media allows you to see pictures of far away relatives quickly.	Helps in spreading awareness on key social issues
7080_7106	goldLabel	a1	We can get more information from world wide because of social media than before which gives us much opportunity to widen our thoughts.	Social media enables interactivity with the mass media. For example, television is a one-way medium. Social media + television provides a feedback mechanism.
6021_7245	goldLabel	a2	Social media saves postal and telecomms costs for example for birthday and christmas cards	Social media allows people to stay in touch, even though they live in opposite parts of the world.
5831_6605	goldLabel	a1	Social media pushes formerly secretive organizations to be more transparent and accountable.	Social media cuts down on gas because people don't have to leave their house to interact.
6523_5720	goldLabel	a1	Social media can allow friends and family members to more actively stay aware of each other's life events.	Social Media helps keep the family together despite distance, time zones and language
5823_6723	goldLabel	a1	Social media is great for sharing photographs with friends and family.	social media opened up new options to advertise our business
5736_6531	goldLabel	a1	Social media is simply enabling communication, which is always a good thing.	Social media helps me to engage with broader list of people then off-line media
7145_6040	goldLabel	a1	Social media promotes engagement and can be a good outlet for shutins or others, such as the socially awkward who struggle with in person interaction.	Dog fail videos are hilarious and boost the spirits of people who watch them. Laughter is the best medicine.
5890_6222	goldLabel	a1	Social media creates a platform to support freedom of speech, giving individuals a platform to voice their opinions and interact with like-minded individuals where they otherwise may not have had one.	IT OPENS UP YOUR MIND TO PUBLIC/FRIENDS- WHICH REFRESH YOU PSYCHOLOGICALLY CHANGES THE NATURE OF A PERSON FOR HONESTY AND GOOD VALUES ONCE PEOPLE SUPPORT THE GOOD WORK.
6485_5750	goldLabel	a1	Used correctly and with a critical eye as to what one is reading, social media can keep distant friends 'involved' in our lives; they can stay up to date with your latest adventures.	How easy it is now, to share what I want to share, and what I want to see. If I am a sane person, I can still use the platform judiciously.
5859_6735	goldLabel	a2	Obtain relevant advertising based on social media searches and posts.	Social media helps people connect across physical limitations
6209_7247	goldLabel	a1	The good far outweighs the negative. Social media is novel and evolving, which is scary. However, the benefits of linking people, business, and institutions together are enormous and are changing the world for the better.	Social media is an instrument that provides the right to normal people to get connected to powerful politicians and people to directly interact. This medium was no there before.
6472_7142	goldLabel	a2	Social media when used responsibly can be a boon to one and all	Social Media enables those who are less confident to better contribute to society
5755_6874	goldLabel	a2	Social Media can help inform people about the things that happen in the world. People spend the best part of their days in it and the majority of news they see were seen through social media	Social media, if we choose to use it judiciously, offers tremendous opportunity to engage with family, friends and community at large across the world and express our views in an unprecedented manner.
5916_7063	goldLabel	a1	Using sparingly, social media helps connecting people together, across boundaries of frontiers, time zones, languages, and backgrounds. It really saves time in that respect.	Social media helps lonely people find friends with common interests even on the other side of the globe.
7063_5981	goldLabel	a1	Social media helps lonely people find friends with common interests even on the other side of the globe.	Social Media often reflects the real life activities of real people
6773_6637	goldLabel	a1	Social media as a way to learn more about diverse life styles from people of different backgrounds	An ability to locate common interest groups, local or otherwise. A quick way to catch up with friends, due to our busy lives.
6241_6401	goldLabel	a2	I would say social media has open a stream of opportunities , you can get career paths or you can get job updates.	Social media assists the lonely in providing them ways, at least partially, of not being alone
6024_6625	goldLabel	a1	Social media allows you to find people with common interests.	The social nature of social media helps to remove bias from news.
6435_7068	goldLabel	a2	Best way of timepass. You will get stuffs from all around the world starting from jokes, news, update on your friends.	Communication is a breeze with social media. What would take forever to disseminate takes exponentially less time to get across the globe.
6468_6675	goldLabel	a1	Social media enables the ability to build community outside the constraints of physical location.	Its an easy and fast way to be updated on your in interest topics
7073_5903	goldLabel	a2	I witnessed Social media significant contributions to bring democracy and free speech to my beloved Tunisia when it was governed by dictators for way too long. Thus Social media brings more good than harm.	Social media helps us find people with similar goals to our own, and provides tools to encourage each other towards attaining our goals. Look at health trackers, and Facebook groups, Twitter hashtags.
6498_5960	goldLabel	a1	Social networks make people closer regardless where people is from, breaking barriers among cultures and having better informed people being more conscious about what is happening around them.	It is the hallmark of the digital age making the world a smaller place. Its primary intention helps gives people new, better and easier means to communicate, network and collaborate, notwithstanding the unintended consequences.
5944_6898	goldLabel	a1	Social media provides one of the best forums for reconnecting with long-lost friends and family and allows people to remain close, even across vast distances.	Social media as a whole has been striving for inclusivity and many of us use one platform or another on a daily basis to get connected with our friends and family.
7104_7048	goldLabel	a1	Social media can be a very good source of information, business ideas as well as social relations. It is up to the user to believe/verify/reject any information.	Social media is s sea full of opportunities for new creative professions also an interesting and flexible platform to express our views which empower us as well as keep us informed .
7275_7139	goldLabel	a2	Social media provides easier access to relatives and friends that were lost out of sight	Social media, if rightly used, can help in connecting with people who can help both personally and professionally.
6397_7187	goldLabel	a2	A good platform for a common man to reach to their leaders to raise voice for noble cause. Which was near to impossible in past. It should be tied to policy and guidelines to avoid misuse.	Recent events in France with the 'Yellow Vests' movement is an example of how social media can empower people to be heard, when public opinion seem to have no more impacts on governments actions.
6651_6235	goldLabel	a2	Social media let you find information or people just with a click	Social media allows for quick diffusion of public health and safety information during crisis events.
5971_5851	goldLabel	a1	Social media helps people connect and keep in touch who otherwise would not have done so	Information spread is faster than traditional way and it is less regulated.
6874_6789	goldLabel	a1	Social media, if we choose to use it judiciously, offers tremendous opportunity to engage with family, friends and community at large across the world and express our views in an unprecedented manner.	Social media is the quickest way to reach out for any kind of help specially in case of emergencies.For eg. in India people traveling in trains are using Twitter to reach out for any support.
6402_6743	goldLabel	a1	Social media makes the world flatter, connecting us with people, cultures and experiences we would have never encountered otherwise.	Social media gives voice to every single human being, like never before.
6400_7197	goldLabel	a1	Social media is a good platform for people to stay in touch and on top of trends.	Social media allows transfer of ideas, images, events, etc. at a much faster rate than that of traditional media (TV, radio, print news, etc.).
6904_6320	goldLabel	a2	Its a good way to make money reducing expenses	Social media was used during terror attacks to help save lives
6803_6979	goldLabel	a1	Social media is an excellent tool and enriches the lives of billions.	Social media ia great. We all like it.
5927_6795	goldLabel	a2	For business promotions, social media is a better and cost effective platform.	It gives us an opportunity to connect with people who have not been keeping touch for a long time.
6854_6264	goldLabel	a1	Those who feel isolated or alone in their beliefs, lifestyle, physical distance, etc. can find others who share their values. People can find a supportive community where they may not have such support elsewhere.	Social media helps to spread what's good across the globe that all can leverage. It's up to us on how moderately we use. Anything at right size is good and so is social media.
6472_6566	goldLabel	a1	Social media when used responsibly can be a boon to one and all	Social media allows people to follow their idols and their whereabouts.
5949_6832	goldLabel	a2	social media is succeeding in bringing people who are physically apart	Social media helps the elderly feel less isolated.
6517_5720	goldLabel	a2	Social media is a way for long-lost friends, classmates or family members to reconnect.	Social Media helps keep the family together despite distance, time zones and language
7227_6226	goldLabel	a2	Simple and nice way to keep up to date and communicate with family members that are close in life but far away in geography.	Social media allows distant families and friends to stay connected and share their lives in a convenient and fun way
6022_6735	goldLabel	a1	Social media allows house-bound elderly people, and other immovable people, to pseudo-interact with others.	Social media helps people connect across physical limitations
5882_5741	goldLabel	a2	Social media allows people to keep in touch with many weak ties, and thus increases their social capital	Social media provides a platform for debate and truly open discussion.
7264_6537	goldLabel	a1	Many of us are too shy to engage in public discussions. Social media allows us to be part of debates by allowing us to carefully choose our words and hone our explanations before we express them.	We should promote the correct usage of social media, rather than banning it or discontinuing it in any way. People should develop the brilliance to use any platform in a constructive way
6528_7264	goldLabel	a1	Families leave such separate lives in distant places that they often lose the feeling of family. Having social media available, lets families and friends reunite even though it is only superficially.	Many of us are too shy to engage in public discussions. Social media allows us to be part of debates by allowing us to carefully choose our words and hone our explanations before we express them.
6888_5852	goldLabel	a1	Social Media gives business platform to interact with their customers faster.	Communication via Social Media is cheaper and faster than traveling, or snail mail.
6229_5828	goldLabel	a1	Social media can easily be used to reach a large audience	It connects the world in a way that change for good can take hold faster.
5823_6531	goldLabel	a1	Social media is great for sharing photographs with friends and family.	Social media helps me to engage with broader list of people then off-line media
6664_6456	goldLabel	a1	Social Media allows to equally and exponencially distribute knowledge among the people in a non-costly and timeless way	Social media helps people share about their lives and connect with others.
6330_6675	goldLabel	a1	Social Media has a positive impact on marketing for clients. It is inexpensive and hits the masses.	Its an easy and fast way to be updated on your in interest topics
6734_6740	goldLabel	a1	Social media embrace the fact that information should be free to share and allow people to express themselves.	Social media is great, it allows me to stay in touch with many friends.
5927_6803	goldLabel	a2	For business promotions, social media is a better and cost effective platform.	Social media is an excellent tool and enriches the lives of billions.
6164_6451	goldLabel	a1	Part of being a human being is feeling connected. Social media helps keep us from becoming isolated as we age and our social contact wanes.	Many a times it happened that, different consumer companies are addressing your complain quicker when it is posted on social media, rather than going through formal process.
