id	annotatorid	label	a1	a2
5625_5339	goldLabel	a2	I think information protection is vital. However, its vital we have more control over what information we share and we be informed what information is being shared before its shared.	Data is becoming the biggest currency in today's world. Data is misused in many ways by cyber attackers specially for naive people that are unaware of cyber security. Privacy laws restricts data access to cyber attackers.
5650_5408	goldLabel	a1	We need privacy laws to prevent companies from abusing information that they collect from us	Information privacy law are there to protect the individual
5395_5268	goldLabel	a2	Data privacy should be a fundamental human right	Privacy is a fundamental human right recognized in the UN Declaration of Human Rights.
5690_5402	goldLabel	a1	One's personal information is fundamentally their own property and they should be enabled to understand how it is used and get their share of the profits it yields. Such change can only be brought by law.	Privacy needs to be respected and governed come what may. But sharing data is individual choice. We need to educate people on what is confidential /non-confidential data. The non-confidential data can be used in commerce purpose
5697_5299	goldLabel	a1	Where laws are transparent and can be demonstrated for the common good, rather than the privileged few, they should be supported.	Tendency is to have information and data privacy laws. If we do not get involved we will not be a good position to influence positive regulatory direction.
5661_5623	goldLabel	a1	Information Privacy laws protect information from being exploited by those that would do others harm.	Absolutely!! That is the only way to regulate and bring sanity to the massive information overload that we live in today
5303_5474	goldLabel	a2	Some people are not overly sensitive about their information because primarily they are not aware of the impact so there should be some privacy laws to regulate their data.	Media, companies and individuals repeatedly demonstrate that they will exploit freedoms for their own purposes rather than with regard to the consequences to others, thus privacy laws become an essential protection.
5516_5555	goldLabel	a1	Privacy is the fundamental right of digital age. Privacy begets trust and trust is the foundation of all relationships. We need to be able to trust the the people/organizations/government and other entities that we interact with.	privacy laws in television is essential. Set top box shares information about what is watched, when and how Long . There is a possibility of raising the charges of most watched channels
5487_5466	goldLabel	a2	For digital commons to be successful, users need to be sure that their submissions will be protected from malicious use	Until companies can sufficiently protect customer data, privacy laws need to be in place to ensure companies value the personal data they collect.
5457_5573	goldLabel	a2	Information privacy laws protect our clients and their clients all the way to the end-user or consumer.	Violation of information privacy may cause severe distress and even trauma. Government should protect the citizens from such violations.
5554_5556	goldLabel	a1	We should support information privacy laws that reasonably support a person's ability to select what, who, with whom and when their private information is shared. This will lead to increased trust in our critical online institutions.	With almost every industry going digital, It's utterly impossible to live without a privacy law. A stringent information privacy law will only pave way to more technological embrace. Technologies dealing in trust, like Blockchain will flourish.
5286_5361	goldLabel	a2	In times of IOT where one could envision a future of each individual having a digital bubble that she lives in, privacy is key to distinguish one from another.	Data privacy laws will ensure every party treats personal data with a bigger sense of responsibility because of the punishable consequences. It will keep us conscious of our actions with data
5702_5318	goldLabel	a2	It is essential to protect and control private information in time of internet. Information privacy laws would play a major roll.	Privacy law will be a focus topic in the next few years as so many data about individuals is collected and this would lead to manipulations of them.
5373_5497	goldLabel	a1	Data Privacy is a fundamental right. No argument. Its urgent &amp; highly necessary with prevalent cyber threats, data piracy, identity theft and bias based on individual, gender, age and other information used for discriminatory decisions.	People with bad intention cannot use the privacy to harm others. They need to know that police can track internet and check their behavior. This should block some misbehavior on most of them.
5317_5448	goldLabel	a1	Privacy should always remain a personal choice, it must forever remain a civil right of an individual. Violating this is equal to putting civilization to jeopardy.	Privacy laws are helping people feel safe using the internet, as now more and more people feel watched and get anxiety.
5278_5398	goldLabel	a2	Increasingly, companies are taking advantage of people by collecting data about them without their knowledge and consent and using it for their own profits.	If we accept that people have a right to privacy then it follows that information privacy should also be protected by law.
5658_5321	goldLabel	a2	Any information derived from direct contact with someone or their digital record SHOULD be protected.	The law should have provisions for everyone to be able to easier control what information is shared about them and to whom.
5494_5351	goldLabel	a1	In the digital age, it can be argued that information privacy is at least, if not more, important than traditional kinds of privacy. Ergo, the need for information privacy laws.	Reams of information is collected about people, that most don't even realize is being collected. Misuse is too easy and rampant. Without laws, companies will not put in the effort to protect people. IBM should lead.
5439_5694	goldLabel	a2	Activity performed under a person's account is not necessarily that of that person's; without privacy, these actions may be erroneously tied to someone and affect how that are treated by organizations privy to the information.	Privacy is a fundamental right for each and every human being and enshrined in privacy laws. Without this, who and what would you trust? It is about respect for each and every living human being.
5688_5422	goldLabel	a2	EU privacy laws seem to be a reasonable place to start since it is in place and already being exercised and debugged. The average computer user is not savvy enough to protect themselves adequately. Protection needed.	Since we live in an era where private information generally finds its way to electronic storage, we need privacy laws to offer protection that in the past was not needed.
5386_5595	goldLabel	a1	Privacy can be converted to profits. Companies collect data from users and convert them into billions of revenue. Protecting privacy is protecting the raw material that has value, like gas and coal.	In my opinion, the most important reason to have privacy laws is less to restrict what companies do, but more just to inform the people whose data you're collecting what you intend to do with it.
5573_5291	goldLabel	a1	Violation of information privacy may cause severe distress and even trauma. Government should protect the citizens from such violations.	In life there are certain information deem to be personal and private.
5330_5303	goldLabel	a1	Several organizations routinely obtain personal information without assuring how that will be used and who will have access to it. We need clear and easy to understand regulations to ensure this assurance.	Some people are not overly sensitive about their information because primarily they are not aware of the impact so there should be some privacy laws to regulate their data.
5274_5668	goldLabel	a2	Individual privacy ensured equals liberty for the people	Privacy is every person's right and laws protecting those rights are good.
5457_5627	goldLabel	a1	Information privacy laws protect our clients and their clients all the way to the end-user or consumer.	Information belongs to the user, so he/she should be the one decide what is given to who.
5304_5626	goldLabel	a1	Data privacy will always be a showdown between technological advancement and privacy laws, we need advancements they consider data privacy	Fundamental to the human existence is the right to be let alone. Privacy underpins most modern human needs.
5401_5331	goldLabel	a1	Our personal lives continue to create more personal data from the devices and services we interact with, and without strict policies in place, we are at risk of abuse.	Technology today allows anyone to monitor, watch, follow, and find out a lot about others. This puts people in a very vulnerable position, without knowing it.
5508_5448	goldLabel	a1	Personal information should not be widely available and is subject to misuse and hence privacy laws are needed	Privacy laws are helping people feel safe using the internet, as now more and more people feel watched and get anxiety.
5408_5460	goldLabel	a2	Information privacy law are there to protect the individual	Individuals should be the only one who are able to sell information about themselves.
5306_5433	goldLabel	a1	Data privacy is protection of the ownership relation I have on data describing/identifying myself, and crucially needed therefore.	I study has shown that people whose privacy has been violated tend to commit suicide.
5668_5692	goldLabel	a1	Privacy is every person's right and laws protecting those rights are good.	My personal information and websites I visit and products I purchase are no one's business but my own.
5271_5686	goldLabel	a2	Lack of information privacy risks serious damage to people and enables vested actors to poach potential customers.	Data Privacy is essential in a world of unbridled social media
5381_5566	goldLabel	a1	My data is my asset. Organisation that collects my data has an obligation to ensure my consent if it is used beyond the original purpose I understand at the point of collection.	We should, of course, observe the information privacy laws. But also, being a global company, we could do a good service by publicly comparing the best and the worst practices of such laws.
5637_5373	goldLabel	a2	With deliberate exposure of consumer involvement and analytics in the globally connected world of the present and future, Information and Data Privacy needs to be statutory and not a mere awareness campaign.	Data Privacy is a fundamental right. No argument. Its urgent &amp; highly necessary with prevalent cyber threats, data piracy, identity theft and bias based on individual, gender, age and other information used for discriminatory decisions.
5651_5614	goldLabel	a2	Young adults make mistakes as part of their natural growth and privacy laws help protect them from damaging and unnecessary exposure whilst they do so.	Information privacy laws increase the value of private information when disclosed, yielding increased economic potential for the use of private data in commercial activities
5301_5633	goldLabel	a1	People will often sacrifice privacy for convenience without understanding the risks of having shared private information.	Yes. It's necessary that companies are responsible and feel responsible to protect the privacy to a certain level.
5396_5290	goldLabel	a2	In the past when you talked to your neighbor in the yard, kept your financial records on paper, and sent postcards telling of your vacations, information privacy laws could be minor, but those days are gone.	The privacy of data is important in order to encourage people to share their data. This data can be used to do statistic work, therefore, improve healthcare and other government systems to prevent issues.
5356_5315	goldLabel	a1	Technology use grows in our homes, and along with that, the loss of privacy. The risks, of private information being breached and publicly shared, should be mitigated by privacy laws.	I support privacy policy as user would be able to use online services more freely as his personal data couldn't be misused and user could provide more honest answers.
5293_5430	goldLabel	a1	As an individual, I should have the choice what happens with my data	We can help enterprises to protect sensitive information
5457_5606	goldLabel	a2	Information privacy laws protect our clients and their clients all the way to the end-user or consumer.	Private information needs to be protected like ownership of property is legally protected. Private information is property as well.
5462_5292	goldLabel	a2	I do not see that the senior people in the technology companies have made all of their personal bank details public, so I can access their personal money. They expect privacy, so do I.	People insufficiently grasp the importance of their privacy and hence give too much away making them possibly easy victims for companies to sell to or worse for hackers to attack them.
5482_5293	goldLabel	a1	Privacy of information is a necessary condition for personal freedom.	As an individual, I should have the choice what happens with my data
5607_5472	goldLabel	a1	Information privacy is important as we add more and more technologies that capture personal information. Private thoughts, pictures, and other data should be owned by the individual and should not be shared to advertisers.	People's information handling process and privacy should be clearly identified to protect everyone confidentiel data and have easy and clear options to share the information and authorize access.
5642_5510	goldLabel	a2	It's unfortunate that some commercial organisations, without effective regulations, will seek to maximise the value of individual's data and overreach. Checks and balances are needed.	Information, especially personal, can be used to do so much within our society. This means that without protecting sensitive data, we are allowing any entity to access and affect our lives.
5627_5663	goldLabel	a2	Information belongs to the user, so he/she should be the one decide what is given to who.	Information privacy laws are important to us to protect our lives.
5304_5261	goldLabel	a1	Data privacy will always be a showdown between technological advancement and privacy laws, we need advancements they consider data privacy	As a user of all kind of offerings I'm demanding a certain level of protection. My credit card number or personal ID shouldn't be revealed to everybody.
5693_5441	goldLabel	a2	Yes, there should be information privacy law because everyone has the rights to secure their personal information and others must respect to it.	The right of each individual about the disclosure and use of his personal data is a fundamental right in civilized countries.
5539_5318	goldLabel	a1	Currently, a huge amount of people's most important and personal data is online. The risks that arrive if this data is leaked or abused are huge, and must be guarded against.	Privacy law will be a focus topic in the next few years as so many data about individuals is collected and this would lead to manipulations of them.
5508_5376	goldLabel	a1	Personal information should not be widely available and is subject to misuse and hence privacy laws are needed	People should have control over what information they wish to share with others
5362_5410	goldLabel	a1	Privacy is a fundamental right of every person and the laws should respect that. Without privacy laws, an individual can be subjected to unwanted harassment due to their personal choices and opinions.	It is unethical to collect data from individuals without their consent and / or without providing clear, easily understood intentions of use for that data.
5396_5607	goldLabel	a2	In the past when you talked to your neighbor in the yard, kept your financial records on paper, and sent postcards telling of your vacations, information privacy laws could be minor, but those days are gone.	Information privacy is important as we add more and more technologies that capture personal information. Private thoughts, pictures, and other data should be owned by the individual and should not be shared to advertisers.
5527_5490	goldLabel	a1	Data is power, the lack of regulation exposes everyone to potentially harmful usage of personal information by bad actors.	Will you feel happy if some third person is watching and recording your daily routines? Obviously, no. So, we should support information privacy laws.
5583_5581	goldLabel	a2	websites ask any question like preferred second language any question similarly &amp; say website , stores this info for our benefit &amp; will not use it / sell it etc etc. privacy is breached	Privacy is a fundamental right for each and every human being and enshrined in privacy laws. Without this, who and what would you trust? It is about respect for each every living human being.
5261_5591	goldLabel	a1	As a user of all kind of offerings I'm demanding a certain level of protection. My credit card number or personal ID shouldn't be revealed to everybody.	By being a role model for information privacy law as a company we will create a advantages compared with companies that handle this topic less severe.
5557_5401	goldLabel	a2	Data privacy regulations protect the personal data that provides safety for the individual (criminal and every day retorsions-e.g. salary info disclosed- even at workplace)	Our personal lives continue to create more personal data from the devices and services we interact with, and without strict policies in place, we are at risk of abuse.
5433_5295	goldLabel	a2	I study has shown that people whose privacy has been violated tend to commit suicide.	Companies will exploit our personal data for their advantage and mint money, if data privacy laws are not put in place.
5557_5466	goldLabel	a2	Data privacy regulations protect the personal data that provides safety for the individual (criminal and every day retorsions-e.g. salary info disclosed- even at workplace)	Until companies can sufficiently protect customer data, privacy laws need to be in place to ensure companies value the personal data they collect.
5637_5552	goldLabel	a2	With deliberate exposure of consumer involvement and analytics in the globally connected world of the present and future, Information and Data Privacy needs to be statutory and not a mere awareness campaign.	Today, personal data in combination with social media outlets can be used to influence behavior, commercially and politically. This can do more harm than good, so strict information privacy laws are necessary.
5473_5381	goldLabel	a1	Privacy needs to be respected by enabling Trust in the digitally powered businesses and also to provide positive customer experience to the end-user through technology.	My data is my asset. Organisation that collects my data has an obligation to ensure my consent if it is used beyond the original purpose I understand at the point of collection.
5300_5469	goldLabel	a1	Like a virus unseen to the naked eye and able to mutate to cause greater harm threats to personal data are largely unperceived by individuals at present and portend unforeseen future dangers. Privacy laws are vital.	"Constitutions are in place to secure the blessings of ""Liberty"". Declarations of independence seek to establish individual rights and personal freedoms. Both support the sanctity of the right to be a free and private individual."
5412_5597	goldLabel	a2	Privacy Laws bring back power to the individual person. No commercialisation of the individual being !	Information privacy laws are supporting the human right to be forgotten
5306_5398	goldLabel	a2	Data privacy is protection of the ownership relation I have on data describing/identifying myself, and crucially needed therefore.	If we accept that people have a right to privacy then it follows that information privacy should also be protected by law.
5417_5432	goldLabel	a2	If limitations are not put in place, companies will be encouraged to gather as much information on individuals as possible in order to monetize it.	The sharing of our data between companies without our explicit consent to do so has the potential to propagate spam calls and with certain information harm to our livelihood.
5505_5462	goldLabel	a1	The amount of personal information shared should be made at the individual's discretion. It would ideally be a currency only given to the most responsible of companies	I do not see that the senior people in the technology companies have made all of their personal bank details public, so I can access their personal money. They expect privacy, so do I.
5576_5595	goldLabel	a1	Privacy laws are need of hour in digital world. Even government agencies should have restricted privacy info based on social needs. Parties involved in flouting laws for benefits, should be penalized to set examples for others.	In my opinion, the most important reason to have privacy laws is less to restrict what companies do, but more just to inform the people whose data you're collecting what you intend to do with it.
5497_5522	goldLabel	a1	People with bad intention cannot use the privacy to harm others. They need to know that police can track internet and check their behavior. This should block some misbehavior on most of them.	As technology and society evolve, our laws and regulations must also evolve. Technology is increasing the level of information exposure for every person on the planet, which requires additional protections.
5618_5394	goldLabel	a1	Consumers have the financial power to force enterprises to keep their information private and used only in cases where there is mutual advantage / benefit	If you are against information privacy laws, then you should not object to having a publicly accessible microphone in your home that others can use to listen to your private conversations.
5556_5555	goldLabel	a1	With almost every industry going digital, It's utterly impossible to live without a privacy law. A stringent information privacy law will only pave way to more technological embrace. Technologies dealing in trust, like Blockchain will flourish.	privacy laws in television is essential. Set top box shares information about what is watched, when and how Long . There is a possibility of raising the charges of most watched channels
5490_5322	goldLabel	a2	Will you feel happy if some third person is watching and recording your daily routines? Obviously, no. So, we should support information privacy laws.	Privacy is to be considered a basic right for all living beings. As we respect the right to live with dignity so is the right to privacy.
5587_5657	goldLabel	a1	Information is becoming the new gold. We must not allow companies to own that information. We already see today how irresponsible and selfish they use our data.	as a company we won't get much credit or business from diverting from supporting information privacy laws this is one reason to support
5543_5324	goldLabel	a1	Without a proper security primer, especially without any more stringent cybersecurity laws and the management of information systems in the hands of political/capitalist environment, how is information privacy going to be put forward without compromising.	Data reveals a lot more about the users than what they are aware about themselves. This can be used to exploit blind-spots &amp; influence/modify behaviors. So freedom of thought &amp; action is at stake.
5622_5663	goldLabel	a1	Information is an asset; and like any asset, security measures are necessary to maintain its integrity.	Information privacy laws are important to us to protect our lives.
5386_5322	goldLabel	a1	Privacy can be converted to profits. Companies collect data from users and convert them into billions of revenue. Protecting privacy is protecting the raw material that has value, like gas and coal.	Privacy is to be considered a basic right for all living beings. As we respect the right to live with dignity so is the right to privacy.
5527_5358	goldLabel	a2	Data is power, the lack of regulation exposes everyone to potentially harmful usage of personal information by bad actors.	The better the privacy law the better will be the privacy and less cyber risk exposure
5455_5600	goldLabel	a1	Information privacy needs to be respected and protected. Strict laws need to be in place to protect information privacy to avoid it from being misused.	data privacy should be a way to protect or digitization human extension on a way that third parties can not take advantage of our private information
5686_5274	goldLabel	a1	Data Privacy is essential in a world of unbridled social media	Individual privacy ensured equals liberty for the people
5671_5482	goldLabel	a2	Yes I agree. Supporting such laws will only help to frame a better future.	Privacy of information is a necessary condition for personal freedom.
5695_5448	goldLabel	a2	With all due respect, it's simply unimaginable to waive privacy laws these days - it's an integral part of our modern technological world.	Privacy laws are helping people feel safe using the internet, as now more and more people feel watched and get anxiety.
5412_5418	goldLabel	a1	Privacy Laws bring back power to the individual person. No commercialisation of the individual being !	Yes we should, current information model creates the sensation of being observed and manipulated on internet.
5334_5271	goldLabel	a2	Letting people choose what others know about them is important to mental well-being and personal autonomy.	Lack of information privacy risks serious damage to people and enables vested actors to poach potential customers.
