id	annotatorid	label	a1	a2
5516_5351	goldLabel	a1	Privacy is the fundamental right of digital age. Privacy begets trust and trust is the foundation of all relationships. We need to be able to trust the the people/organizations/government and other entities that we interact with.	Reams of information is collected about people, that most don't even realize is being collected. Misuse is too easy and rampant. Without laws, companies will not put in the effort to protect people. IBM should lead.
5456_5300	goldLabel	a2	Do you want unscrupulous business people to know about the places you went for vacation with your family during last Christmas, so that they can monetize your family members? You are smart enough to understand.	Like a virus unseen to the naked eye and able to mutate to cause greater harm threats to personal data are largely unperceived by individuals at present and portend unforeseen future dangers. Privacy laws are vital.
5566_5282	goldLabel	a2	We should, of course, observe the information privacy laws. But also, being a global company, we could do a good service by publicly comparing the best and the worst practices of such laws.	Data is not created equal, its purpose not always clear at creation, its potential usage not always malicious. However, people are intelligent, naive, emotional, rational, gentle and hurtful. Privacy should protect the minority and the majority.
5276_5675	goldLabel	a1	Privacy can not be comprised. It should be protected at any cost. Loss of privacy can result in financial loss. Also loss can cause harm to one's social status and reputation	Confidential bank information, medical history or likes &amp; preferences of people should be governed by IP laws to ensure they are not made available to miscreants and misused in the wrong hands.
5481_5479	goldLabel	a2	Companies and authorities should be bounded by strict regulation to make sure they use the people's personal data in a governed way similar to what GDPR offers in Europe.	Personal information is a prized commodity for bad actors. If mishandled it can lead to a host of problems that can end in financial ruin and reputation loss. So data privacy practices should be strengthened.
5581_5484	goldLabel	a1	Privacy is a fundamental right for each and every human being and enshrined in privacy laws. Without this, who and what would you trust? It is about respect for each every living human being.	Companies using data for financial gain have no incentive to be reasonable in the way they process and use data. So practices cannot be expected to change without imposed regulations.
5417_5310	goldLabel	a1	If limitations are not put in place, companies will be encouraged to gather as much information on individuals as possible in order to monetize it.	It's difficult to imagine modern society without privacy laws - when everything is out there on the web, we're allowed to keep some elements of our privacy.
5439_5292	goldLabel	a2	Activity performed under a person's account is not necessarily that of that person's; without privacy, these actions may be erroneously tied to someone and affect how that are treated by organizations privy to the information.	People insufficiently grasp the importance of their privacy and hence give too much away making them possibly easy victims for companies to sell to or worse for hackers to attack them.
5497_5481	goldLabel	a1	People with bad intention cannot use the privacy to harm others. They need to know that police can track internet and check their behavior. This should block some misbehavior on most of them.	Companies and authorities should be bounded by strict regulation to make sure they use the people's personal data in a governed way similar to what GDPR offers in Europe.
5284_5498	goldLabel	a2	In stead of being a leader, the US is a laggard in regard to implementing regulations and the rights of users to maintain privacy and security of their personal information. I support these laws.	In today's digital world, we share personal data frequently and we have no control over usage of those information we share. A strong privacy law will ensure data is not misused by any company or government.
5441_5685	goldLabel	a1	The right of each individual about the disclosure and use of his personal data is a fundamental right in civilized countries.	There is certainly a need to restrict at every stage what the companies can know and what they should know.
5443_5629	goldLabel	a1	Albeit hindering the quality and extend of some on line services, privacy laws offer the partial empowerment to the individuals regarding the exploitation of their private life and behavior, which they should ultimately have.	"As the information grows so as the privacy laws growth. For example: ""your browsing history will tell you what kind of person you are"". So, digital discipline is must for global peace."
5328_5317	goldLabel	a2	Our information belongs to us and should not be freely used to advertise at us. Laws are ultimately the only way to deter bad practice.	Privacy should always remain a personal choice, it must forever remain a civil right of an individual. Violating this is equal to putting civilization to jeopardy.
5284_5607	goldLabel	a2	In stead of being a leader, the US is a laggard in regard to implementing regulations and the rights of users to maintain privacy and security of their personal information. I support these laws.	Information privacy is important as we add more and more technologies that capture personal information. Private thoughts, pictures, and other data should be owned by the individual and should not be shared to advertisers.
5487_5367	goldLabel	a2	For digital commons to be successful, users need to be sure that their submissions will be protected from malicious use	Information privacy laws will protect people from having their information abused and taken advantage of.
5301_5702	goldLabel	a1	People will often sacrifice privacy for convenience without understanding the risks of having shared private information.	It is essential to protect and control private information in time of internet. Information privacy laws would play a major roll.
5402_5481	goldLabel	a1	Privacy needs to be respected and governed come what may. But sharing data is individual choice. We need to educate people on what is confidential /non-confidential data. The non-confidential data can be used in commerce purpose	Companies and authorities should be bounded by strict regulation to make sure they use the people's personal data in a governed way similar to what GDPR offers in Europe.
5517_5445	goldLabel	a1	Privacy laws are very important especially as we see populists and extremists taking the power in some countries.	65% of Americans say they should control what info is collected about them
5573_5254	goldLabel	a1	Violation of information privacy may cause severe distress and even trauma. Government should protect the citizens from such violations.	Information privacy laws should be worded carefully in order to keep citizens safe without sacrificing safety
5638_5607	goldLabel	a2	Sharing personal information is for specific purposes at the time I share that information. Further usage or sharing of that information in an ambiguous, unauthorised or misleading way mus be stopped &amp; protected by privacy laws	Information privacy is important as we add more and more technologies that capture personal information. Private thoughts, pictures, and other data should be owned by the individual and should not be shared to advertisers.
5278_5318	goldLabel	a1	Increasingly, companies are taking advantage of people by collecting data about them without their knowledge and consent and using it for their own profits.	Privacy law will be a focus topic in the next few years as so many data about individuals is collected and this would lead to manipulations of them.
5293_5643	goldLabel	a2	As an individual, I should have the choice what happens with my data	Widespread collection of personal information puts people's privacy and security at risk.
5572_5470	goldLabel	a2	There is no higher value than privacy and that should be key for all companies	Strong information privacy laws will protect people by making sure internet companies do not misuse people's data
5456_5610	goldLabel	a2	Do you want unscrupulous business people to know about the places you went for vacation with your family during last Christmas, so that they can monetize your family members? You are smart enough to understand.	Information privacy rules are more important now than ever. Our personal data should only be used with our explicit consent for the purposes intended. We should be notified and compensated for any commercial usage.
5567_5686	goldLabel	a2	Without observance to privacy laws, no solutions won't be recognized as adoptive.	Data Privacy is essential in a world of unbridled social media
5409_5449	goldLabel	a2	Few companies today have unfair advantage due to having a monopoly in their market. Privacy laws are needed to stop them from using this power unfairly.	"Information privacy is important to ensure that identity theft is minimised as the social media platforms share information across the ""sellers"" of products and services"
5552_5335	goldLabel	a1	Today, personal data in combination with social media outlets can be used to influence behavior, commercially and politically. This can do more harm than good, so strict information privacy laws are necessary.	US should fully support a GDPR-type law. There is too much potential for data misuse by both companies and individuals. Americans/US Residents should have same rights as Europeans to see/delete data
5422_5264	goldLabel	a1	Since we live in an era where private information generally finds its way to electronic storage, we need privacy laws to offer protection that in the past was not needed.	Technology and policy should support the maxim that information of a person is owned and controlled by that person. By what right do entities take that away?
5462_5330	goldLabel	a2	I do not see that the senior people in the technology companies have made all of their personal bank details public, so I can access their personal money. They expect privacy, so do I.	Several organizations routinely obtain personal information without assuring how that will be used and who will have access to it. We need clear and easy to understand regulations to ensure this assurance.
5263_5413	goldLabel	a2	"As ""the enemy knows the system"" (Shannon) privacy is the major challenge in the times of quantum computing at its applications to cryptography"	Data should not be used without the user's acceptance to generate revenue to third party companies
5327_5317	goldLabel	a2	while it is true that people share information willingly, they do not consent to selling their information. We need privacy laws to ensure that people give there consent.	Privacy should always remain a personal choice, it must forever remain a civil right of an individual. Violating this is equal to putting civilization to jeopardy.
5307_5479	goldLabel	a2	We need to enforce privacy laws in all AI bot/systems built by companies/Government built using models/data from individual data to not result in discriminatory results to coerce, make political/ financial gain and control our choices.	Personal information is a prized commodity for bad actors. If mishandled it can lead to a host of problems that can end in financial ruin and reputation loss. So data privacy practices should be strengthened.
5300_5394	goldLabel	a1	Like a virus unseen to the naked eye and able to mutate to cause greater harm threats to personal data are largely unperceived by individuals at present and portend unforeseen future dangers. Privacy laws are vital.	If you are against information privacy laws, then you should not object to having a publicly accessible microphone in your home that others can use to listen to your private conversations.
5566_5385	goldLabel	a2	We should, of course, observe the information privacy laws. But also, being a global company, we could do a good service by publicly comparing the best and the worst practices of such laws.	Because of the power and resource asymmetry between businesses, governments on one hand, and individuals on the other, only having privacy laws that are enforceable can permit individual data sharing with clarity.
5698_5358	goldLabel	a2	You should always be made aware of what companies are doing with your data.	The better the privacy law the better will be the privacy and less cyber risk exposure
5306_5445	goldLabel	a1	Data privacy is protection of the ownership relation I have on data describing/identifying myself, and crucially needed therefore.	65% of Americans say they should control what info is collected about them
5386_5581	goldLabel	a2	Privacy can be converted to profits. Companies collect data from users and convert them into billions of revenue. Protecting privacy is protecting the raw material that has value, like gas and coal.	Privacy is a fundamental right for each and every human being and enshrined in privacy laws. Without this, who and what would you trust? It is about respect for each every living human being.
5435_5494	goldLabel	a1	The US needs to adopt data privacy laws similar to GPDR. With all the information collected and disseminated overtime, this represents opportunity to hackers to steal your identity, credit, even stalk you and terrorize you.	In the digital age, it can be argued that information privacy is at least, if not more, important than traditional kinds of privacy. Ergo, the need for information privacy laws.
5554_5286	goldLabel	a1	We should support information privacy laws that reasonably support a person's ability to select what, who, with whom and when their private information is shared. This will lead to increased trust in our critical online institutions.	In times of IOT where one could envision a future of each individual having a digital bubble that she lives in, privacy is key to distinguish one from another.
5560_5338	goldLabel	a1	Your personal information is valuable and should be protected. It should not be taken freely or in an underhand manner	Companies, by definition, cannot own information about individuals and thus cannot sell it.
5387_5698	goldLabel	a2	As important as laws protecting our privacy is the need for strong audit mechanisms	You should always be made aware of what companies are doing with your data.
5522_5369	goldLabel	a2	As technology and society evolve, our laws and regulations must also evolve. Technology is increasing the level of information exposure for every person on the planet, which requires additional protections.	Data Privacy is important as people should know what they are sharing with whom, they are entitled GDPR laws protecting them from misuse and provide proper compensation while making privacy a topmost priority for any company
5572_5573	goldLabel	a2	There is no higher value than privacy and that should be key for all companies	Violation of information privacy may cause severe distress and even trauma. Government should protect the citizens from such violations.
5639_5292	goldLabel	a2	Data is the new oil. Without Privacy laws the data can be used in multiple ways to even manipulate my choices even without my knowledge.	People insufficiently grasp the importance of their privacy and hence give too much away making them possibly easy victims for companies to sell to or worse for hackers to attack them.
5658_5334	goldLabel	a2	Any information derived from direct contact with someone or their digital record SHOULD be protected.	Letting people choose what others know about them is important to mental well-being and personal autonomy.
5686_5296	goldLabel	a1	Data Privacy is essential in a world of unbridled social media	I support privacy laws because I believe that these are for my own good.
5644_5270	goldLabel	a2	It is very important to safeguard sensitive information which in wrong hands can cause material or life loss.	Information privacy laws improve our society because without them companies will continue to take advantage of our private information for unethical purposes.
5421_5381	goldLabel	a2	Governments and businesses must be fully opt-in, transaction by transaction. All data should be purged at the click of a request, without impacting services received.	My data is my asset. Organisation that collects my data has an obligation to ensure my consent if it is used beyond the original purpose I understand at the point of collection.
5606_5692	goldLabel	a1	Private information needs to be protected like ownership of property is legally protected. Private information is property as well.	My personal information and websites I visit and products I purchase are no one's business but my own.
5293_5458	goldLabel	a2	As an individual, I should have the choice what happens with my data	Privacy laws will make consumers trust the providers that adhere to the laws.
5409_5398	goldLabel	a1	Few companies today have unfair advantage due to having a monopoly in their market. Privacy laws are needed to stop them from using this power unfairly.	If we accept that people have a right to privacy then it follows that information privacy should also be protected by law.
5702_5421	goldLabel	a1	It is essential to protect and control private information in time of internet. Information privacy laws would play a major roll.	Governments and businesses must be fully opt-in, transaction by transaction. All data should be purged at the click of a request, without impacting services received.
5347_5274	goldLabel	a1	Data privacy is important to fight cybercriminals and other sort of evil doers	Individual privacy ensured equals liberty for the people
5680_5447	goldLabel	a2	Unfettered access to people's data is espionage. This is the enemy of a free society.	All private data should be protected from being used for any kind of manipulation.
5642_5476	goldLabel	a2	It's unfortunate that some commercial organisations, without effective regulations, will seek to maximise the value of individual's data and overreach. Checks and balances are needed.	Information privacy is necessary to protect user information in the age of AI and targeted marketing. Without protections bad actors will use personal information to personalize advertisements that trick people to consume.
5347_5445	goldLabel	a1	Data privacy is important to fight cybercriminals and other sort of evil doers	65% of Americans say they should control what info is collected about them
5270_5640	goldLabel	a1	Information privacy laws improve our society because without them companies will continue to take advantage of our private information for unethical purposes.	If data privacy can not be insured, people will not be willing to release private data, thus this will reduce the results of big data analytics
5409_5555	goldLabel	a1	Few companies today have unfair advantage due to having a monopoly in their market. Privacy laws are needed to stop them from using this power unfairly.	privacy laws in television is essential. Set top box shares information about what is watched, when and how Long . There is a possibility of raising the charges of most watched channels
5433_5419	goldLabel	a2	I study has shown that people whose privacy has been violated tend to commit suicide.	If a person or company's information is freely shared, there is no control over how that information is used.
5563_5615	goldLabel	a1	Information privacy laws are important to protect people from discrimination based on their political viewpoint.	No commercial agreement should ever be subject to giving up your privacy.
5564_5556	goldLabel	a2	Technological companies influence has grown dramatically over the past decade. Their terms and conditions change sometimes several times a year and users are captive and unable to understand some implications. This begs for Checks and balances.	With almost every industry going digital, It's utterly impossible to live without a privacy law. A stringent information privacy law will only pave way to more technological embrace. Technologies dealing in trust, like Blockchain will flourish.
5356_5497	goldLabel	a1	Technology use grows in our homes, and along with that, the loss of privacy. The risks, of private information being breached and publicly shared, should be mitigated by privacy laws.	People with bad intention cannot use the privacy to harm others. They need to know that police can track internet and check their behavior. This should block some misbehavior on most of them.
5335_5522	goldLabel	a2	US should fully support a GDPR-type law. There is too much potential for data misuse by both companies and individuals. Americans/US Residents should have same rights as Europeans to see/delete data	As technology and society evolve, our laws and regulations must also evolve. Technology is increasing the level of information exposure for every person on the planet, which requires additional protections.
5401_5679	goldLabel	a1	Our personal lives continue to create more personal data from the devices and services we interact with, and without strict policies in place, we are at risk of abuse.	Facebook is in the news for violating its own privacy policy that it submitted to users. We need laws that insure swift and strict consequences to companies who sell the public a false sense of privacy.
5618_5614	goldLabel	a2	Consumers have the financial power to force enterprises to keep their information private and used only in cases where there is mutual advantage / benefit	Information privacy laws increase the value of private information when disclosed, yielding increased economic potential for the use of private data in commercial activities
5414_5614	goldLabel	a1	We should support a well-written set of information privacy laws. Privacy is a basic human right and should be protected. The laws should however be effectively implemented by government authorities.	Information privacy laws increase the value of private information when disclosed, yielding increased economic potential for the use of private data in commercial activities
5492_5591	goldLabel	a1	As human beings we all say and do things that are misinterpreted or that we simply didn't mean and thus we need protecting from ourselves through privacy laws.	By being a role model for information privacy law as a company we will create a advantages compared with companies that handle this topic less severe.
5674_5604	goldLabel	a2	Trust is the fabric of our society &amp; having information privacy laws helps secure our society.	Information privacy laws protect us against companies that sell our secrets in order to make money out of it.
5638_5539	goldLabel	a1	Sharing personal information is for specific purposes at the time I share that information. Further usage or sharing of that information in an ambiguous, unauthorised or misleading way mus be stopped &amp; protected by privacy laws	Currently, a huge amount of people's most important and personal data is online. The risks that arrive if this data is leaked or abused are huge, and must be guarded against.
5542_5695	goldLabel	a1	Information privacy laws should be supported as a means of protecting users and preserving personal liberty.	With all due respect, it's simply unimaginable to waive privacy laws these days - it's an integral part of our modern technological world.
5265_5300	goldLabel	a2	How can a company or an establishment use ones data without their permission for every use of any type., there is lot of loop holes if we do not get the steps.	Like a virus unseen to the naked eye and able to mutate to cause greater harm threats to personal data are largely unperceived by individuals at present and portend unforeseen future dangers. Privacy laws are vital.
5511_5310	goldLabel	a1	The power in data and information is immense. To much data and information, especially if it is from many different sources is dangerous in any hands.	It's difficult to imagine modern society without privacy laws - when everything is out there on the web, we're allowed to keep some elements of our privacy.
5637_5272	goldLabel	a2	With deliberate exposure of consumer involvement and analytics in the globally connected world of the present and future, Information and Data Privacy needs to be statutory and not a mere awareness campaign.	With the proliferation of social media and people willing to share private information freely without any thought of how it can be used, the strict privacy laws can act as safeguard and gatekeeper to the info.
5436_5458	goldLabel	a1	Information privacy laws are important to protect individuals	Privacy laws will make consumers trust the providers that adhere to the laws.
5481_5548	goldLabel	a2	Companies and authorities should be bounded by strict regulation to make sure they use the people's personal data in a governed way similar to what GDPR offers in Europe.	My information is mine. It does not belong to anyone else. I should control who has access to my information. My right to privacy should not be erased because it is in a digital format.
5394_5610	goldLabel	a2	If you are against information privacy laws, then you should not object to having a publicly accessible microphone in your home that others can use to listen to your private conversations.	Information privacy rules are more important now than ever. Our personal data should only be used with our explicit consent for the purposes intended. We should be notified and compensated for any commercial usage.
5565_5347	goldLabel	a2	If you don't legislate data privacy, the markets will do it for you.	Data privacy is important to fight cybercriminals and other sort of evil doers
